,stars,comments
882,5,"I was hesitant on purchasing the new iPhone X, I thought the lack of a home button and the new Face ID would be a disappointment. Days before receiving it in the mail I wanted to cancel My order because I was convinced I would not like it. Every time I used someone else’s x I had trouble understanding its functionality. One day after transferring over the the x I couldn’t be happier. It really is the most amazing phone. Everyone that had one was trying to explain to me how amazing it is but the point is you can’t explain it. You just have to use it. It becomes an extension of you."
883,5,Phone works great Swipe works better than the home button I think Love the new design!!
884,5,"I have own previous I Phones, and when I up graded they always have newer technology. The I phone X has by far leaped in keeping with today's demands. AT&T has treated me and my daughter very well. The employees know their stuff."
885,5,"really like all features ,but one. The ringtone is not loud enough to hear well."
886,5,The iPhone x is awesome does more than I have ever seen a phone do before
887,3,I only did it for the 2 for 1. It is ok but it takes for ever to download emails and sometimes other data.
888,5,I had an iPhone 6plus it was huge I love this x
889,5,Excellent I will recommend to everyone.
890,2,"I had high hopes for the long awaited iPhone X. I must say that I am disappointed with lack of new features. The only new feature is the Face ID and perhaps standard camera upgrade. Otherwise there’s nothing much different than the 6, 7 or 8."
891,4,"I really like the new iPhone X. The functions of the phone are great, the one thing I’m disappointed in is the screen size. It’s not as wide as my iPhone 6s Plus, even thought the screen stretch’s the whole length of the phone everything on the screen is smaller. It’s hard to go backwards. I hope the next phone out is bigger."
892,5,I enjoy all the features of the iPhone X.
893,5,"Face ID is nice , go get you one ASAP"
894,5,Amazing technology. A huge leap forward
895,5,This phone is a great. All that needs said.
896,5,everything I would expect of an iPhone and more.
897,5,I’ve had an iPhone on and off since 2010. I’ve been the girl who would go back and forth through Samsung and iPhone. And overall I’m sticking with iPhone. I just switch from the note 8 and even though I lived the note 8 I had to go back to apple and get the X ive had this phone for a week and I am very impressed with the phone. The Face ID works great even in very low light. It’s worked about 98% of the time which was about the same for me as Touch ID. Of course when it does work just put in the passcode. The phone fits great in my hand. I like how it’s small like the 8 but the screen is BIGGER than the 8 plus even if it doesn’t seem like it. The cameras are amazing as usual and the Animoji feature is so much fun. I did have a slight problem after the 3 day. The screen went black and took 10 mins to turn back on. I was about to return but I realized it needed an update and it’s been working fin ever since. I do think the price of the phone needs to be lower and it was hyped up a little too much but over all I love it. Ppl wanted a change from apple and now they got it. Just keep in mind that no phone is perfect.
898,5,"I bought the X after having a 6 Plus and have been very happy with it. The size is better, it looks better with glass on the front and the back and the functionality is easy to grasp. One of the aspects I like is the removal of the home button. It used to get fingerprints on it and wouldn’t work so I had to use the passcode which was a pain. Now, I just hold the phone up and it works due to facial recognition. If you are willing to pay the hefty price tag, I highly recommend the iPhone X."
899,5,If you can afford it why not have the best out! Love the video and Steady shot in the camera and video
900,5,"Love it! It's taking some getting used to using facial recognition while using Apple Pay, clicking the side button twice first is awkward. Otherwise, it's great."
901,5,Best iphone ever! Great upgrades and fastest it could be!
902,5,"I love the new Apple iPhone X. I love all the new feature and how easy it’s to use. It’s the best iPhone yet! Camera is heads and tails better than my 6S. No more blurry pictures. Love, love, love it."
903,2,I didn't like the iPhone X I'm glad I returned it it was disappointing all the way around I went back to my plus size iPhone 8 plus I love it way better only thing was good about the iPhone X was the speed and camera all the hype is gone about the iPhone X as a iPhone user if you love the plus size stick it with it iPhone X will not be for you.
904,5,I really love how fast it is and the wireless charging option is great
905,5,Phone is simply perfect. Best phone ever!
906,5,Great phone Worth the wait Had not upgraded since iPhone 6 plus
907,4,"The phone freezes up quite often, did a update on it hoping It would fix the problem, but it did not. Other then the freezing up the phone is pretty cool"
908,5,"Love the format, the size, battery life and everything else!"
909,5,"I’ve been with Apple since day 1 of 2007 and the X is by far the best phone to date for sure!! No matter what people are saying about the 7 plus being bigger it’s def not,just read the specs that should be enough right there and all the great new features that come with this phone are fantastic if your due for an upgrade get the X you will not be disappointed,don’t be fooled by the bunk reviews the X is by far the best Phone on the market today!!"
910,5,"I think this is a really good phone. It took some adjustment to my habits, but I am glad I made the switch from the iPhone 7. Face ID works every time and is MUCH faster than Touch ID. New features like the camera and the hard-press keyboard functions are great. Screen is much bigger, so one-handed operation is harder but I never did that much anyway."
911,5,"Before I bought the IPhone X I read almost every review I could. I saw people complaining about the phone size, the screen size, the durability, and the fact that some apps don’t take up the whole screen. WELL I went from the iPhone 7 Plus and I love the phone being small with the screen being bigger I can still see the same as I did on the 7 pulse but I also don’t have to worry about it not fitting in my hand very well. I’ve already dropped this thing twice and there’s nothing wrong with it at all (I don’t have the glass screen protector and a speck case though. Also most of the apps do fit to my screen perfectly the only one I have seen not is my schools app which makes sense cause they probably aren’t to worried about updating it just for the new phone. I love this phone though very easy to use, really cool features, and the camera is TO DIE FOR. I really like not having a home button, it actually makes it easier and the facial ID works really fast."
912,5,"So, First before i start my review i think its important to understand that reviews are not the end all be all of products and services, but they do provide sort of a glimpse into certain aspects of what to expect and potentially look for. All in all its up to the consumer to decide whats best for them and what they like. With that being said, ny personal opinion on the Iphone x is that its great!! I have been an Iphone user for close to 10 years now and haven't had any issues with any of them as i have not had any issues with my 10. I have had my phone for a week now and am really enjoying it. What i appreciate most about apple products is the simplicity of use. Apple really simplifies everything and it makes for the most seamless experience when it comes to their devices. Does it always come out with a new feature first? No there are several other devices that have features that apple doesn't have and features that apple has added that have been around for a while i.e. wireless charging and face recognition. Apple gets killed because it doesnt always come out with something first. Thats not a bad thing to not be first all the time. When they do reveal something its again in a more seamless and strategic way they makes it effortless. if you are looking for a quality phone then the iphone is a solid choice."
913,1,"I have been trying the iPhone X for several days, upgrading from my iPhone 6 Plus. While it has some cute features, there is not enough to justify the price tag. I'm not sure there is enough to justify a lower price tag. The screen is smaller than my previous phone and requires two hands to use most of the time. I am returning the phone to try and find one with the simplicity I enjoyed."
914,5,"I can't understand the negative reviews. I have owned every I Phone since their inception. The I Phone X is hands down the best to date. Maneuvering the screen is slightly different but you adjust quickly. The home button is actually an improvement in my opinion. Facial recognition took less then 2 minutes to set up. Additionally facial recognition is quicker and more efficient then the old thumb print on the home button. Battery life, so far, is outstanding. My other I phones I was charging every 12 hours or so based on my usage. My I Phone X is being charged about every 24 hours. A major improvement, although my results may not be typical. Buy it I don't think that you will have any regrets."
915,5,After first week forgot how use and hold Android good work.
916,5,This phone is perfect for me. I upgraded from the 7 plus and the phone is smaller so it fits my hand better but the screen is actually bigger than my old phone. Gaming and sound quality is outa this world.
917,5,The best cellphone in the market for now for the smart phone i we’ll definitely like this one
918,3,"I had my phone for a week so far I’m not impressed with the service I’m getting I’m not sure what’s going on it always searching for service when trying to use the internet or social media, even in the city I have issues with it loading today I recieved a text message 40 min after it was sent to me, my iPhone 6pus had better service than this one, going in tomorrow to see what att could do about it or return it"
919,5,I’ve had the phone 2 days so far and I’m liking it a lot.
920,5,"Love the facial recognition, large screen on a smaller phone than the 7+"
921,5,"Phone is all around incredible. Ridiculous 4K recording. Best battery i have had, better than galaxy s8 plus by a ton"
922,5,I’m loving this actually. So easy to use. Learning more everyday I use it. Way to go Apple. You’ve done very well with this one
923,5,Upgraded from a 6 plus and love it!
924,5,I love the iPhone. My only gripe is waiting for shipping but this phone is a amazing. The AT&T rep Hosh was so helpful and that was amazing.
925,4,The slide & facial recognition is super and so much easier to use and user friendly! Can’t see why anyone would waste money on an 8 when this technology seem to be leaps and bounds ahead of the 8!!!
926,5,"I owned a iPhone se came to iPhone X the improvements are speechless, I am in love with my new iPhone X. Never in my life was I excited about a phone till this one came out! The speed the graphics it is without a doubt the greatest phone of our time."
927,5,This is by far the best iPhone ever and it will get better as more updates come
928,3,"Apple would have you believe that this is the greatest smartphone ever, with the largest screen of any iPhone. But that's not quite true. Measured diagonally, X has a 5.8"" screen versus the 5.5"" of the 8S. But you have to knock part of that off because the ""horns"" are unusable space in your apps. What you end up with is a screen that is slightly taller than the 8S, but also slightly narrower. You have virtually the same amount of screen. Unfortunately, watching video in full screen leaves a section cut-out on the side or the other option is to center the video, giving you a much smaller viewing area with black bars on all four sides than if you were watching the same video on the 8S. The build of the phone is trumped-up to be ""surgical grade steel"" and ""the hardest glass ever on a phone."" Watch the drop-tests to see how easily the glass breaks and see how slippery the ""surgical grade steel"" is to hold onto. You will definitely want a case for your handset. Break the back of your phone? Apple will charge you over $500 to repair it! While the processors and memory run quite efficiently with IOS (the best feature of an iPhone), IOS itself has become buggier with each iteration. Autocorrect has gone bonkers with IOS 11, autocorrecting words for no apparent reason or changing letters on you. It's great that Apple has ""gotten with the times"" and offers fast charging and wireless charging. Unfortunately, the charger included in the box isn't a fast charger - there is a separate charge for that. Same goes for the Wireless charging. Apple is really pushing AR (augmented reality) as if they invented it. AR has been around for years and is much simpler than VR (virtual reality). You've probably been using AR for years without even realizing that is what it was. Such as apps like Messenger or Snapchat putting hats on your head or making you puke a rainbow. Or hunting Pokémon where you see the Pokémon in the real world through your camera's viewfinder. Yep, that's AR and it's been around. When Apple lets you strap a VR headset to your face and explore get back to me. All in all, the phone is a nice next step from Apple and they are finally getting with the times. But it's not the greatest phone ever made nor the greatest iPhone ever made."
929,4,"What can I say.....it is a really nice device. Does it live up to the hype, I am not sure just yet. With all of the tech, it will be a device of the future. I have not had any issues with the face ID as has been reported on a few reviews. However, need more apps to be updated to take advantage of everything the phone can do."
930,5,"This is a great new phone and the path to the future. Cool new features (I know Samsung had most of them already), but now Apple does it with flair. If you don't like change, you wont like it, but get used to change!"
931,3,"Awesome phone, but it is not worth the money that the phone cost."
932,5,I heard all whistles and bells regarding the IPhone X and was a little bit hesitant of the needs to upgrade from my IPhone 6 plus. Unfortunately I dropped my IPhone 6 plus and now was to make a decision of fixing it or getting a new one so I ordered the new IPhone X. The delivery was fairly fast and by my surprised I was soon to find out that the upgrade was very much noticeable. This phone is the best IPhone ever and do bring a great advantage in the market. this is my experience I do not want to bring technical review but you should do your homework. I chose the 256GB considering that many apps are getting bigger the lower option might not be enough memory by the time I paid your phone off.
933,5,I have been happy with my phone. Was very easy to set up and easy to use. The camera is awesome
934,5,I love this iPhone! The size is perfect and the camera is awesome.
935,5,"I’ve had every iPhone since the iPhone 3GS and the iPhone X is been best! I love the full screen, Face ID, and new gestures."
936,5,"Fast, sleek and reliable! While appealing the eye, the function of the phone is on point! Love the convenience of face recognition, speed of processor and the entertainment of the virtual emotions!"
937,5,I love the iPhone X! Not hard to use especially not haven’t the home button. Only issue I see is the speakers. They are not as clear as my previous IPhone 7 and I hear this cracking/popping sound. So weird.
938,5,Apple has done it again. 4K 60fps 4K 24fps no one has this not even super expensive dslr’s. Screen is the best in the industry colors are spot on. I love how it fits perfect in my hand. It is the perfect balance of size and screen realestste. It doesn’t feel overly big tlike the 7 plus did. This phone is a straight monster in performance destroying everything in the market. Face ID is spot on and the gestures are super easy to learn people just don’t like change and complain. Is it worth the money? Yes it is the camera alone is worth the price having all of the shooting options right in your pocket. Well done Apple.
939,3,"After using it for a week, I’ve discovered that I miss several aspects of the IPhone 7 Plus. Miss the battery percentage being available on the top right corner without having to swipe. Miss the home button and it’s double click features. Miss the full screen without the camera affecting the view amongst other small but significant things."
940,1,Hate the size!!!! Way to small compared to the iPhone 7 Plus.
941,5,Legit phone no bad aspects
942,5,"I recently pre-ordered the iPhone X 256 GB on October 27th. It shipped on November 7th. I was so excited about the phone that I picked it up from the post office. I took the box to AT&T store and it was activated right out the box. Let’s get to the point, the phone is very nice, sleek, and sexy. It the Face I.D works just as good as Touch ID if not better. The technology they put into making this device is extremely powerful and accurate. This is the iPhone I’ve been waiting for since 2007. The camera on this phone is superb and does so many different things. Facial recognition is even tied into your emojis which is nice. The battery life on this phone actually is very good. It last me the entire day and some with moderate to heavy usage."
943,5,"People can talk about how Samsung has been the pioneer of new advancements in next gen phones; that might be true, but you can’t compare to Apples reliability and durability of their phones. I’m contastantly asked to use my phone because an app/battery doesn’t not work on a Samsung phone. The iPhone X is a beautifully design phone. The battery/processor/camera stand out. I was skeptic about the Face ID, but I love the fact I can just log in to anything with just my face."
944,5,Everything I expected and more!
945,5,Worth every penny. Easy transition from the 6plus to the X.
946,4,It’s a good phone but. Bit confusing.
947,5,"Having had every iphone since the first, ands few Galaxy phones as well) I can honestly say that the iPhone X delivered on all fronts. The screen is exceptional to look at. The keyboard seems a little small coming from the 7 Plus. The notch is a non issue during use. Many apps have not optimized for the use of the entire screen and screen dimensions. I think in short term the little quirks will all be worked out quickly by the app developers and Apple. I am very satisfied with the speed of the phone. And the video and picture quality is top notch."
948,5,This is the best by far Apple has done in a while. Other then the durability issue. This is a flat out win
949,5,I upgraded from a 5s. This phone was worth the wait and learning more features on it every day. It’s a 10plus for sure!
950,3,"Most durable glass ever? I laugh! Attached is a pic of my iphone x right out of the box, i cant speak on anything else as i have not even turned it on."
951,5,Excellent phone works really well especially in the dark the face recognition is amazing. compared to the other phones they did it a little better on the battery. love this new phone.
952,5,If u like apple. This is the best there is. But if your a andriod person you will always hate the iPhone.
953,2,"I upgraded from iPhone 7Plus and I am regretting it. The X is very small compared to 7Plus and holding the X simply is undesirable. The keyboard has entirely too much wasted space and still without multitask keys. FaceID works without any issue and is quick! However, the bottom line is...it’s still just an iPhone"
954,3,"I am no average reviewer; I worked as my companies phone manager for over 2 years so I have used every Samsung from S4 up to every iPhone ever made. Pro’s - Great Display. - Size is perfect. The standard iPhone is too small but the plus is too big. - getting adjusted to no button was easy. - Battery lasts longer. - Animoji’s are cool and I know we will have some cool AR apps that yse this tech. Con’s - Price is too steep - Fragile phone. Now I haven’t dropped mine but I did see the test on durability and this phone failed. - Lots of apps don’t use the full screen. - The keyboard is still too small. - Auto correct has a glitch in it, and cannot be used. - Animoji’s freeze or don’t work at times. - sound switching is still an issue - Facial recognition doesn’t work all the time. - Siri still isn’t very smart. I asked her what my email address is and she told me she ran into a problem. - Copy and paste still isn’t better than the Galaxy. - Finally price. This phone has an inflated price point."
955,5,"Beautiful phone. Nice feel to it, good size and overall happy with my purchase."
956,5,"Just one word, Amazing , great design ,great Screen, loved the new improved OLED screen, Camera captures the intricate details , high resolution pictures and videos . Face ID works smoothly , easier than Touch ID to setup. Animoji is fun. Moving towards the future, this iPhone upgrade is definitely worth it . Apple has always been an innovator. Great Product. Hands Down iOS."
957,4,"The iPhone X is great so far, only one crazy glitch, the volume turns up on it's own after about 5 minutes of listening to music. Does it every time, volume just doubles all by itself...???"
958,5,"I absolutely love this phone !! I wasn’t planning on getting it but when I saw it in person and played with it my jaw dropped . Absolutely amazing !! Super easy to use . I thought I wouldn’t get used to not having the home button , the thought scared me but it’s super simple to go back home. The screen is huge! The battery life is super long . Super clear videos , and the pictures WOW Amazing!!!! I love it !!! Best purchase ive made!!"
959,3,"As I stated in my first review, the screen is too small on the X, about the size of the iPhone 7. I know the specs say 5.8"", but there is an upper and lower part of the screen that acts like a bezel and is not used. I had to set the AT&T sales people straight and show them the 8 plus has a bigger screen! The keyboard is quite larger on the 8 plus, as it is wider!"
960,5,If you are looking for a new iphone experience the X is the way to go i know its expensive but i think its worth it
961,5,This phone felt weird at first but it felt better after every hour of owning it. It’s amazing!!!
962,4,"All in all very good iPhone. A little different on getting around, but changes are welcomed. Facial recognition works great. Only issue so far is brightness changes even with auto bright and true tones turned off."
963,5,Apple still makes the best OS and best devices.
964,5,"I am more than pleased with my new X! I previously had the 7 plus which I loved BUT the X is the perfect size to manage with one hand again which is the one thing I missed going to the plus. No home button, no problem, it was a quick and easy adjustment. I only miss the percentage option for battery indicator. OVERALL SOLID DEVICE! I’ve had every phone since 3g iPhone!"
965,5,This is an awesome phone. My favorite to date.
966,4,iPhone X is a step above the rest in terms of camera and screen! Videos look awesome and wireless charging is super convient! Expensive device but At&t always has awesome promos!
967,5,"Everything in this phone is amazing the pictures,the face recognition I’m in love!!!"
968,5,"This phone is awesome!!! I love the slimness . I can reach across it with one hand. I love the glass & chrome, very unique . And I don’t miss the back button at all . I have a clear case so I can see the phone . And the Animoji’s we have laughed till we cried lol plus I’m still learning lots of fun & interesting things about it everyday."
969,3,"I love the screen and clarity. But I’m having a hard time letting go of my iPhone 7+. I thought the camera on the X would be as good, if not better than the 7+ and the flashlight is no where near as bright as my previous iPhones. Not having a button is actually a nice change. I Like the simplicity of swiping to open and close apps. The new iOS is an improved change too. The only issue is moving items around in settings. No one should have to google how to as an email account to an iPhone of they already own an iPhone. Nor should you have to open every tab trying to find where that feature has been moved. Overall, I like the X, but I’m still on the fence about keeping my 7+. I’ve got 11 more days before I have to return it. Hopefully the good will outweigh the bad."
970,5,"Still playing w/it. However, I can say that I miss the home button. Don’t really care for the side button function. But will see, I’ll give it a little more time."
971,5,"Got this on launch day and honestly can’t believe how much I like it. First, the camera is amazing. That alone is worth the change. Having a screen that is essentially the same size as my 7+ in a phone that fits much better in pocket. Best smartphone yet."
972,5,Love the full screen and size.
973,5,A awesome phone with outstanding results...
974,1,Responding to comments from my earlier post. The iPhone X is just to smal especially if you are used to having the plus model iPhones like I have had. Why spend the extra money for Face ID and Animojis??? The new iPhone 8 and iPhone X have just topped the charts as the most fragile smartphones out!!! And they are by far the most expensive to repair. In my opinion they aren’t worth the extra money. I’m a true Apple fan but the new iPhones have let me down so I will be keeping my iPhone 7 Plus and jumping ship to the Samsung Note 8. I have faith that Apple will do the right thing and make a plus sized iPhone X next year but until then I won’t hold my breath
