,stars,comments
298,5," C'est un excellent remplaçant pour mon GS6. L'écran donne une nouvelle dimension à l'utilisation d'un smartphone (j'ai du mal à utiliser d'autres tel maintenant), il y a aussi l'autonomie qui est excellente (une journée avec la 4G + le wifi + le Bluetooth + la géolocalisation + une luminosité a 75%), on a là un smartphone très haut de gamme (2017) qui sait être réactif. Au niveau des performances, je ne suis pas fan des jeux sur le PlayStore mais j'aime bien jouer à la psp avec son émulateur (ppsspp) celui tourne à merveille et ne bouffe presque rien de ma batterie. Enfin l'appareil photo est tout aussi excellent même en basse luminosité. L'appareil frontale est très bon aussi (fini la mauvaise qualité sur snapchat). L'absence du bouton physique sur la façade ne se fait pas ressentir grâce au ""force touch"" de Samsung implémenté à cet endroit. Le capteur d'empreinte se situe à l'arrière mais on s'y habitue très vite. La surcouche ajouté par Samsung est bien plus agréable que le TouchWizz d'avant et il permet une navigation fluide mais aussi personnalisable.  Avis complet  "
299,4," C'est un autre univers ;) C'est plus qu'un téléphone mobile. En bref, c'est excellent.  Avis complet  "
300,5, Tres bon produit obeis au doigt et l'oeil  Avis complet  
301,3," C est un très bon téléphone haut de gamme qui fais tout ce qu' on lui demande sans faillir à sa tâche. Attention car le téléphone en lui même est très fragile donc coque + étui de protection à prévoir en plus de l achat du téléphone. Petit soucis après 2 semaines d'utilisation, l'écran est devenu bleu d un coup pendant une utilisation rendant le téléphone inutilisable... Résultat minimum de 3 semaines de réparation au Sav darty pour un défaut d'usinage...  Avis complet  "
302,5," J'ai reçu le téléphone rapidement. Délai d'une semaine. Le téléphone était bien emballé. Le téléphone fonctionne très bien après 15 jours d'utilisation normale. Rien à dire en particulier à part que pour le moment, je ne regrette pas mon achat.  Avis complet  "
303,5," fluide, rapide, puissant . ecran est de super qualité un tres bel appareil mais pas ""donné""  Avis complet  "
304,5, Jadore ce telephone dommage que certaines appli ne sont pas encore faite pojr ce format decran  Avis complet  
305,4," Fluide rapide l'écran est sublime. Beaucoup de fonctionnalités pratiques. Les photos sont de bonne qualité. En mode selfies attention de ne pas bouger, image parfois flouté. Très bon téléphone et très classe.  Avis complet  "
306,4, Rien à dire de particulier sur l'achat. Je ne m'en suis pas encore servi car je viens de le recevoir mais de ce que je vois il est conforme à ma demande !!  Avis complet  
307,5," Ce smartphone est parfait : puissant, beau (il met 5 ans de retard au design des autres smartphones), facile à utiliser, les photos sont bluffantes, il y a plein d'options pour simplifier la vie de l'utilisateur, ultra personnalisable (contrairement à un iPhone). Les points faibles sont : la fragilité, on devient un peu parano tellement on a peur qu'il tombe (d'après des tests vus sur des sites externes) et l'autonomie (en gros 16h en utilisation moyenne et 12h en utilisation intensive. Aussi, l'assistant Bixby n'existe pas en français et est donc inutile pour l'instant.  Avis complet  "
308,5," Acheté en remplacement de mon 5S de la marque à la pomme, je recherchais un téléphone qui ne connaît pas de ralentissement, réalise de belles photos, propose une autonomie de 1 à 2 jours. Mon bilan après 3 semaines : - pas d inquiètude pour récupérer les données sur mon 5S, l application Samsung switch se charge de tout en connectant les 2 téléphones avec l adaptateur fournit, photos, sms, contact, applications proposées sur le google Play, il faut juste réaliser une sauvegarde du 5S sans mot de passe pour que l application puisse accéder au contenu du 5S, tuto trouvé sur la toile. - Esthétiquement le S8 est magnifique et l écran de toute beauté. - après un temps d adaptation, les systèmes d exploitation sont très similaires. - l autonomie est excellente, un jour en utilisation intensive et 2 jours en modérée (2 a 4 heures de surf et jeux journalier) - l Apn fait de très belle photo et vidéo, la colorimétrie est plus vive sur Samsung - enfin un téléphone qui mouline, ne ralentit pas et chauffe raisonnablement. - j étais inquiet pour que le s8 tienne dans la poche, mais il en est rien, il est moins large qu' un 5.5 pouce, c est le format idéal! - toute les applications ne sont pas encore compatibles avec le format de l écran, un peu de patience. - dernier point, j ai profité d une promo offrant 200 euros de remise et revendu mon 5s, j ai donc craqué et je ne regrette rien. Merci boulanger et merci pour les conseils en magasin.  Avis complet  "
309,5," très bon produit , plusieurs fonctions de verrouillage .  Avis complet  "
310,4, Le téléphone est magnifique. Le format est idéal. L'autonomie est correcte pour l'instant (plus d'une journée). Par contre quelques défauts : le tactile a une latence que je ressens comparé au galaxy s6. De plus l'écran courbé n'a pas que des avantages: les protections d'écran en verre trempé ne collent que par les bords donc le tactile va mal répondre et la protection va se décoller si vous mettez un etui trop protecteur.  Avis complet  
311,5, Super téléphone beau design avec super qualité d'image. Je suis très contente de mon achat.  Avis complet  
312,5," aucun problème pour cet achat , réception ds les temps , parfaitement emballé et téléphone impeccable  Avis complet  "
313,4," Présentation: très bien. Ligne presque trop épurée tellement cet appareil est fin . Qualité d'image très élevée. Utilisations pour les fonctions de base faciles et acquises rapidement. Par contre il y a un peu trop de fonctions ""avancées"" telles Bixby , authentifications biometriques et autres qui pour moi sont plutôt gadgets inutiles. Il est vrai que j'ai 73 ans et que je préfère que les choses soient simples. Un beau bijou de technologie tout de même.  Avis complet  "
314,5, Un smartphone ultime à l'écran fabuleux.  Avis complet  
315,5," Appareil au top , livraison très rapide et sans soucis .  Avis complet  "
316,5," Flagship certain mais pas sans petits défauts. Batterie un peu light, format du smartphone et de l'écran discutables mais le design, la puissance la prise en main compensent largement. La qualité de réception me semble exemplaire même chez Free. Reste pour le moment sans réponse la question de la solidité...et du coup(t) des réparations :) Enfin, Nougat arrivera-t-il à nous faire profiter pleinement et sereinement du S8 ? Merci Darty pour la promo ^^ Magic S8 !  Avis complet  "
317,5," Je suis très satisfaite de cet achat,je recommande totalement cet article qui fonctionne parfaitement sans aucun problème  Avis complet  "
318,4," Quel écran ! On s'approche de plus en plus du bordless complet avec ce Galaxy S8. Le format est spécial, ça ne pose pas de soucis particulier pour les application en général, sur les jeux je ne saurai dire (je ne joue pas sur smartphone) et pour les vidéos les seules ""compatible"" que j'ai pu voir sont des sample dédiés a ce type de format. Sinon, faut recadrer/croper via un petit raccourcis qui s'affiche brièvement à l'écran. Malgré ce crop, le rendu est du plus bel effet ! La surcouche est correct, sans réelles innovations majeurs comparé à Touchwiz. On a ici plus à faire à un lifting complet, un home personnalisable (on est quand même très loin des launcher type Nova) avec pas mal de thème complet (modifiant l'ensemble de la surcouche pas que le home) sur le store Samsung, beaucoup étant gratuit. Le tout fonctionne sans accroc. Le nombre d'application installé par défaut ayant été radicalement réduit, bon point. La dernière mis à jour intègre le ""full screen navigation"", la barre de navigation disparaît dans les application (mais pas sur le home), rendant la navigation encore plus immersive ! Bixby, difficile d'en juger à l'heure actuelle, une maj viens d'être déployé en France au moment ou j'écris ces mots, l'assistant vocal étant toujours indisponible en français. Prometteur, mais étant principalement compatible avec les application Samsung et quelque exceptions. Dommage, en attendant les prochaines mis à jour pour éventuellement voir si d'autres application seront compatible. En l'état, c'est raté pour moi. L'appareil photo est magnifique. Moi qui suis généralement allergique ou appareil photo mobile, je dois reconnaître que c'est maintenant bien fichu. Venant d'un Xperia Z3, je peux affirmé que le bond de performance comparé à cette génération est ahurissant. Le capteur d'empreinte mal positionné mais ça reste utilisable pour moi. Malheureusement, d'autre font mieux sur ce point avec un placement bien plus cohérent. Le gros point noir de ce S8 est sa fragilité. L'investissement dans un coque est indispensable dès le départ. L'autre soucis, c'est la protection écran : il faut faire très attention a ce que la vitre en verre (ou le film) ne soit pas trop large en fonction des coques. Bref, la galère à protéger. Je ne regrette pas mon achat, beau (c'est subjectif) et très agréable a utiliser au quotidien (sans révolutionner). Une étoile en moins pour la fragilité et la difficulté à protéger le smartphone.  Avis complet  "
319,5," A CE JOUR LE MEILLEUR APPAREIL CHEZ SAMSUNG, JE LE CONSEILLE FORTEMENT  Avis complet  "
320,5," Ce téléphone est juste super. Une fluidité imbattable sur tout type d'application. Aucun lag, et un appareil photo de qualité. Préférez l'achat chez Fnac pour la garantie de la qualité du produit. J'ai acheté mon s8 chez Fnac il y a deux semaines lors de la promo, et je ne regrette en rien! Livré très rapidement.  Avis complet  "
321,5," Beau design , la batterie tient bien.belle qualite d image et le son est bien pour regarder fes video.facile d utilité je ne changerais pas mon téléphone. Un peu chère mais ce sont les prix sur le marché  Avis complet  "
322,5, Conforme à ce que j'attendais de la marque. Content de mon achat.  Avis complet  
323,2, Tout est dans le titre .. La batterie du s8 que j'ai acheté me déçois Elle se décharge rapidement alors que j'ai une utilisation normal et non excessive de mon produit  Avis complet  
324,5, Téléphone cher mais vraiment top. Qualité de photo magnifique et autonomomie vraiment parfaite pour mon utilisation. Je passe du samsung galaxy s6 au s8... on voit clairement la différence et l'évolution.  Avis complet  
325,5," Je l'ai depuis un peu plus d'une semaine et je suis complètement satisfait. J'avais un nokia 930 avant et le rapatriement des contacts s'est avéré un peu difficile mais j'ai fini par y arriver. Le téléphone est sublime, fin et ergonomique. L'écran est également une merveille. Si vous hésitez, foncez ! Achat avec un vendeur partenaire GadgetsInfinity: Il y avait deux étiquettes ""Ne pas accepter si déchiré"" une intacte collée sur une déchirée, mais le produit ne présentait aucune marque d'usure. de plus, les délais de livraison n'ont pas été respectés (5 jours pour l'expédition au lieu de 2 annoncés).  Avis complet  "
326,4," Prise en main aisée, fluide Un peu déçu de la couleur moins flashie que ce que l'on pensais  Avis complet  "
327,5," Très bon produit, comme toujours à un prix exorbitant pour du haut de gamme mais qui tient ses promesses. Espérons qu'ils fonctionnent aussi bien dans 2 ans...  Avis complet  "
328,5," Très satisfait de mon achat, vendeur sérieux et livraison rapide, on peut acheter en toute confiance..  Avis complet  "
329,5," Bon produit, bonne qualité, bonne emballage, rien à redire.  Avis complet  "
330,5, Excellent produit. Il a toutes les qualités recherchés et très simple à utiliser.  Avis complet  
331,5, et un bon appareil photo de depanage  Avis complet  
332,5," Super design, fin avec les côtés incurvés, rapide, il répond à toutes mes attentes, j'adore.  Avis complet  "
333,5, Je recommande ce téléphone beau intuitif leger  Avis complet  
334,5," Reçu en temps record, bien emballé, que du positif !  Avis complet  "
335,5, Simple Rapide Top Très bon smartphone Je connaissais mieux iPhone et je ne suis pas déçue  Avis complet  
336,4, Bon produit dans la logique de ce que fait la marque  Avis complet  
337,4," Il est rapide, beau avec une bonne autonomie et une excellente qualité  Avis complet  "
338,5, J'hésitais depuis un bon moment à franchir le pas et c'est la promo avec le pack chargeur induction coque et protection d'écran (tous de la marque samsung) qui m'ont fait craqué. La prise en main demande un petit temps d'adaptation quand on a jamais eu de smartphone avec des bords incurvés. Je suis très satisfait de mon achat. Reste à voir dans le temps avec l'usure.  Avis complet  
339,5, Très bon smartphone Ce qui se fait de meilleur en ce milieu d'année 2017  Avis complet  
340,5," Tout est top pour ce téléphone, beaucoup d'évolutions (positives) par rapport au Galaxy S6 que je possédais avant! Rien à redire, Samsung a fait du très bon boulot! Seul bémol, le premier appareil que j'ai eu avait un sous-pixel mort, Fnac me l'a immédiatement remplacé!  Avis complet  "
341,5, Un bijou!! j'adore! en violet il est top!  Avis complet  
342,5," reception du colis en parfait état, repond à toutes mes attentes, merci  Avis complet  "
343,5," Téléphone très agréable à utiliser. L'écran est magnifique, le côté incurvé ne gène pas du tout la lecture. En termes d'encombrement, il est pour moi tout juste à la limite de ce qui me convient en termes de taille (je m'étais fixé une longueur de 150mm max). Je viens d'un téléphone pur Android et je trouve que le changement se fait bien même s'il est parfois difficile de s'y retrouver dans toutes les options Samsung. Le capteur d'empreintes apparait finalement assez naturellement sous le doigt. Je n'ai pas encore testé toutes les photos mais rien le capteur frontal est d'une qualité impressionnante. La batterie est un peu limite pour le téléphone de cette taille mais c'est bien mieux que ce que j'avais avant. La possibilité d'étendre la mémoire est un plus  Avis complet  "
344,5," Livraison rapide, matériel conforme et bien emballé, comme à chaque fois, rien à redire.  Avis complet  "
345,5," lors d'une periode speciale, le s8 vendu chez Darty avec le pack chargeur par induction, coques de protection à 600e, j'estime que c'est tres bon prix pour le moment. Commander sur le net, 2 heures apres je suis alle le recupere au magasin. c'est parfait rien à dire. Merci Darty.  Avis complet  "
346,5, Smartphone génial rien à dire rapide fluide jolie je ne regrette pas du tout mon choix :D si vous voulez la perfection le s8 est se qu'il vous faut ;)  Avis complet  
347,5," Je viens d'un Honor 7, qui hormis ça batterie qui m'a lâché faisait très bien l'affaire. l'écran de ce S8 m'a bluffé, en plein soleil on peu toujours voir très confortablement ce qui ce passe sur le tel. J'ai eu un peu de mal avec la prise en main au début car j'avais ma paume de la main sur les coté arrondi de l'écran mais ca part très vite! l'ecran amoled ne consomment beaucoup moins de batterie j'arrive a tenir quasiment 2j sans recharge en utilisation ""normal"" (Jeux + fb + messenger + texto + insta ...)  Avis complet  "
348,5," que dire... Dès qu'on l'a en main, il semble évident que c'est le smartphone qu'on recherchait. Il ne décoit pas !  Avis complet  "
349,5, Ce smartphone est juste parfait!  Avis complet  
350,5, Le designe un peu trop allongé ne me plaît pas trop mais le processeur est ce qui m'intéresse avant tout.  Avis complet  
351,5," Beau, fonctionnel, maniable, qualité photo irréprochable, etc...  Avis complet  "
352,5, Je me régale...Pour moi le meilleur smartphone...  Avis complet  
353,5," Très pratique , plein d'options sympa et il est très rapide. Le gros plus c'est la qualitée des photos, incroyable  Avis complet  "
354,5, Je suis extrêmement satisfait de mon achat. Ce téléphone et tout simplement une tuerie. Très facile d'utilisation. Lâcher Apple sans hésitation. Peace  Avis complet  
355,4, Excellent téléphone bonne prise en main. Pour les fans de Samsung je le recommande vivement  Avis complet  
356,5, TRES SATISFAITE ET UN BON PRODUIT ET LA LIVRAISON RAPIDE BRAVOOOOO  Avis complet  
357,5," Vous n'allez pas être déçu !! Excellent mobile à tous les niveaux Fluide , rapide ,exellente résolution d'image Autonomie correcte et appareil photo magic ...  Avis complet  "
358,5," Pratique, beau et a de très nombreuses fonctionnalités que je continue à découvrir tous les jours.  Avis complet  "
359,5, Ce smartphone est un excellent téléphone. Son prix est très attractif. Je recommande vivement cet article.  Avis complet  
360,4, deja fendu une vitre de protection dans la poche ! attention fragile  Avis complet  
361,4, J'ai acheté mon téléphone la semaine dernière et j'en suis tres satisfaite.  Avis complet  
362,5, La qualité des photos est impressionnante. Le touché de l'écran est très agréable et le passage d'une application à une autre est très fluide. Je n'ai pas encore découvert toutes les fonctionnalités du téléphone mais j'en suis très satisfaite.  Avis complet  
363,4," A part un peu d'attente, j'ai eu rapidement toutes les réponses à mes questions. Le téléphone est fonctionnel comme s'il était acheté en France et en plus j'ai eu le connecteur Français en sus. Très bien, 200 euros de moins, ca vaut le coup d'attendre un peu pour la meme chose.  Avis complet  "
364,4, FACILE A UTILISER ET TOP OUR RECUPERER ELEMENTS SUR ANCINE PORTABLE  Avis complet  
365,5, Bel appareil avec toutes les fonctions facile utilisation  Avis complet  
366,5, Je suis ravi de ce smartphone! Le rendu de l'image est sublimé par son incroyable écran! Niveau design Samsung est clairement passé devant ses concurrents avec ce s8. En revanche ce design le rend certainement plus fragil en cas de chute du fait de la bordure d'écran extrêmement fine. Je recommande donc de le proteger un minimum.  Avis complet  
367,5, Une merveille de beauté mais surtout une puissance et une rapidité extra.  Avis complet  
368,5, prix livraison délais impeccables la FNAC peut prendre des leçons!!!!!!!!!  Avis complet  
369,5, Le Samsung Galaxy s8 est vraiment génial Beaucoup de nouveautés intéressantes  Avis complet  
370,3," Ecran extrêmement fragile, une rayure au bout de deux semaines .... ayant eu les galaxy SII, S4, Note, Note I, Note II, Note III, Note 10, Note 12.2 et Tab S2 pendant plusieurs mois il n'ont eu aucune rayures. Un traitement de l'écran loin d'être à la hauteur des modèles précédent. En vue des prix pratiquaient je pensent sérieusement à ne plus suivre la marque Samsung. Très déçu...  Avis complet  "
371,5, Téléphone intuitif très performant  Avis complet  
372,5, J'ai commander cet article er j'en suis super satisfaites il a tous ce dont je rechercher.  Avis complet  
373,5, Parfait livre dans les delais conforme a la commande  Avis complet  
374,5," Avant j'étais fan d'Apple... Mais ça, c'était avant... Maintenant c'est avec Samsung que je suis le plus comblé. Ce Galaxy S8 est parfaitement adapté à mes besoins. Il se déverrouille soit quand je le regarde (reconnaissance de mon iris), soit quand je positionne mon index sur le capteur d'empreinte en moins d'une demi seconde (et il peut le faire de plusieurs autres façons). Il est vraiment rapide dans l’exécution des applications. De plus les prochaines mises à jour ont l'air assez prometteuses avec Google Assistant et Bixby, qui contrairement à certaines idées reçues me semble un excellent moyen de regrouper toutes ses informations personnelles quotidiennes dans un seul outil. En d'autres termes, ce smartphone est devenu un véritable assistant numérique. Je le trouve particulièrement beau avec son écran légèrement incurvé sur les côtés. Il est déjà tombé 2 ou 3 fois sans avoir eu aucune égratignure (peut-être que j'ai eu de la chance sur ce coup là). Je vous recommande vivement ce somptueux produit !  Avis complet  "
375,5," Smartphone cher, mais d'excellentes qualité. Très bonne qualité d'affichage, excellent GPS avec Galileo, excellent appareil photo. Un excellent smartphone pour les experts.  Avis complet  "
376,5, Très bon produit Arrivé rapidement en point relais darty  Avis complet  
377,4, Une chute a suffit a fisuré l'écran.... le téléphone est top et simple d'utilisation.  Avis complet  
378,5, Qualité photo: au top Fonctionnalité: au top Bluetooth double connection: une revolution  Avis complet  
379,5, Je vous recommande de mettre directement une coque pour protéger le téléphone  Avis complet  
380,5," BEST PHONE EVER!!! BEAU, STYLE, PUISSANT.  Avis complet  "
381,5, Le Samsung S8 est très pratique et simple d'utilisation. La couleur est superbe.  Avis complet  
382,5, je suis ravi de mon Samsung 8 il est top de top rien a redire j ai vraiment un bijou dans les mains la meilleur des marques c est sumsung jai toujours eu cette marque et je le recommande aucun regret de mon achat  Avis complet  
383,5," Je passe d'un Galaxy S5 à ce S8, et la différence est bluffante. Le téléphone est fluide, puissant, et son écran incurvé est absolument magnifique.  Avis complet  "
384,5, Tres bon produit ! Écran incroyable !  Avis complet  
385,4, Très beau smartphone. Bonne prise en main. Peut glisser facilement. Je recommande l'achat d'une coque de protection. Dans mon cas Spigen néo hybride + film Spigen.  Avis complet  
386,2," Téléphone extrêmement fragile au niveau de l'écran certes très beau mais même pas un mois après l'achat, j'ai déjà une rayure sur le haut de l'écran alors que je suis hyper!! Soigneux. Aucun problème de ce genre avec mon Galaxy s7 edge. Je suis déçu par Samsung surtout qu'à mon avis il ne changeront pas le téléphone. Un téléphone vendu très cher et finalement pas à la hauteur.  Avis complet  "
387,4, Honnêtement il surclasse l iPhone 7 mais trop fragile  Avis complet  
388,5, Prise en main très facile. Un petit bijou de technologie  Avis complet  
389,5," Ecran magnifique, logiciel au point, léger, mais à protéger avec une coque car le dos a l'air fragile. L'autonomie aurait pu être un peu mieux, on tient cependant 1 journée sans problème. Le prix est pour moi un peu trop élevé, j'ai attendu une promo pour l'acheter.  Avis complet  "
390,5, Pas cher et au top Je suis très satisfait de mon achat. Bien moins cher que Cdiscount.  Avis complet  
391,5," Tres beau téléphone , superbe ecran Fluide et pas de bug Autonomie dans la bonne moyenne .  Avis complet  "
392,4," Techniquement, rien à dire, l'appareil photo est très bon, le design et son format est top. Le capteur d'empreintes est cependant très mal placé, au point qu'on finit par ne plus l'utiliser. Comme je m'y attendais, la ROM de Samsung est bof, venant d'un OnePlus One c'est assez dérangeant de redécouvrir le monde des bugs en tout genre. Certaines apps gèrent très mal le remplissage de l'écran (par exemple: app PriceMinister -> ""Appuyer ici pour remplir l'écran"" -> reboot), le Smart Lock marche de façon complètement aléatoire pour les lieux de confiance, impossible de désactiver complètement l'allumage de l'écran à l'appui du bouton Home, ... Plein de détails qui gâchent la partie software pour ma part, mais bon rien de surprenant sur un Samsung. A côté de ça ils proposent quand même des choses bien comme Game Tools, multi-fenêtres et capture d'écran personnalisée. Si la promo n'était pas si intéressante j'aurais clairement pris le OnePlus 5, mais ce S8 est quand même très bon.  Avis complet  "
393,5, Bon plan pour un nouveau smartphone Samsung  Avis complet  
394,5, Adepte de la gamme galaxy depuis un moment. Passer du s5 au s8 est un réel changement Fluidité rapidité utilisation et j'en passe sont au top. Cependant le seul bémol est l'autonomie du téléphone un peu court selon moi  Avis complet  
395,5," Je recommande cet appareil, Samsung a vraiment réussi ce modèle 2017  Avis complet  "
396,5, J'ai pu profiter d'un s8 neuf chez Darty en ce jour de fête nationale. 559 € pour un s8 neuf. Merci Darty  Avis complet  
397,4, Retrait facile en magasin A renouveller  Avis complet  
398,5," Tous les engagements pris par Darty ont été respectés (delais, prix etc) Bravo !  Avis complet  "
399,5, Imbattable. Attention fragile. Protections téléphone plus chères que les autres smartphones...  Avis complet  
400,4," Très peu de problème à l'achat ou d'utilisation, le seul défaut est la position de la sortie audio.  Avis complet  "
401,5, livraison dans les delays et materiel extra  Avis complet  
402,5, Un vrai régal ! Design et ergonomie au top du marché !  Avis complet  
403,4, conforme et plutôt bon prix mais expédition peu rapide  Avis complet  
404,5," Téléphone neuf arrivé en parfait état dans de bon délais (2 semaines) pour un prix sidérant ! Seul ombre, le sellé sur la boite Samsung avait été coupé et un autre avait été rajouté par dessus... le téléphone marche parfaitement donc pas a se plaindre pour autant.  Avis complet  "
405,5, Lisibilité rapide pour les renseignements voulus. Description conforme. Envoi rapide. A voir en cas de problème si je resterais aussi satisfaite.  Avis complet  
406,5," Téléphone dans la boîte d'origine, tout les accessoires standard sont la. Attention chargeur pas français mais adaptateur universelle offert  Avis complet  "
407,5, Rien à dire juste excellent mais manque le papier de garantie  Avis complet  
