,stars,comments
147,5, Téléphone portable neuf très bien emballé marche très bien par contre le chargeur est anglais mais il y a un convertisseur pour la norme française  Avis complet  
148,5," Il est très fluide, agréable et fonctionnel, la qualité de l'image est excellente. Il répond parfaitement à mes attentes. Son utilisation au quotidien me permet d'être en permanence connecté et informé.  Avis complet  "
149,5," Appareil au top, remise en place des données très facile de mon fidèle s4 avec smart switch. Du grand Samsung  Avis complet  "
150,5," Technologie à la pointe, magnifiques couleurs que ça soit pour la photo que la vidéo en soirée, merci je suis satisfaite, par contre livraison Chronopost express pas respecter + 5 jours, aucun geste commercial de fait!:(  Avis complet  "
151,4," Super smartphone, très fluide au look sympa. On conseillera d acheter les coques et verre de protection rapidement car c est un appareil très fragile. Attention à la chute. Sinon rien à dire, c est du beau travail, merci Samsung  Avis complet  "
152,5, Bien emballé. Délais de livraison courts. Rien à dire.  Avis complet  
153,5, Très beau bonne performance écran infinity magnifique du bon et magnifique Samsung  Avis complet  
154,4," Le S8 a remplacé mon S4 âgé de 4 ans avec un écran assez fissuré. Après quelques temps d'utilisation, je considère que le S8 est très complet, facile à utiliser mais avec un paramétrage trop abondant ce qui amène à une certaine complexité d'utilisation. Pour un usage basique, toute la sophistication logicielle ne sert à rien. Un appareil à réserver pour les geeks ou pour ceux qui aiment fouiner dans les paramètres.  Avis complet  "
155,5, Le top rapide et pas cher  Avis complet  
156,5," Je suis ravis téléphone géniale. Je l'ai reçu en 3jours très bons services de cdiscount. Et avec le telephone tput les accessoires, même un adaptateur USB pour votre téléphone ! Je recommande vraiment a tout le monde !  Avis complet  "
157,5, Livraison rapide et produit conforme. très satisfait de mon produit S8  Avis complet  
158,5, Bonne experience avec cet achat et l'utilisation de ce telephone je recommande  Avis complet  
159,5," Très bon produit, je ne suis vraiment pas déçu, beau design et surtout très costaud et très beau, facile à utiliser, j'adore!  Avis complet  "
160,4," Encore une fois innovant, une vraie machine de guerre... rien de négatif pour l'instant à signaler au top du top  Avis complet  "
161,5," J'ai ce téléphone depuis quelques semaines. J'avais jusque là un Windows Phone de 2015, donc forcément la différence est flagrante. L'écran est top, la fluidité, les photos, tout me convient. Je ne l'utilise pas du tout pour jouer mais je peux regarder des films en 1080p sans souci. C'est confortable. Je suis très content d'avoir craqué. C'est cher, mais si on aime ça, ça vaut le coup.  Avis complet  "
162,5," J'avais le s7 edge rose et bien je peux vous dire que je préfère largement le s8 qui est beaucoup plus fin car j'ai un meilleur maintien. La couleur noir est super chic et classe. Sa faisait longtemps que j'avais pas pris un smartphone noir et maintenant je préfère largement il passe partout et se fait discret. Il est arrivé vite en 3 jours en comptant le jour férié. Bien emballée et la boîte est bien neuf. Niveau rapidite nickel, La batterie tiens normalement une journée après sa dépend de votre utilisation. Je regrette pas mon achat et je le recommande. Pour le prix sa vaut le coup car en magasin c'est casiment 2 fois plus cher.  Avis complet  "
163,5," Pour faire un cadeau a ma fille, elle en est ravis.  Avis complet  "
164,5, Je suis très satisfai du produit. Bon investissement  Avis complet  
165,5, Je l'ai cela va bientôt faire une dizaine de jours et j'en suis très ravie.  Avis complet  
166,5," Vu les prix, j ai douté du site. Mais après réception ( 1 petite semaine) je dois avoué le sérieux de global. Très bon produit, le meilleur dual Sim du marché selon moi.  Avis complet  "
167,5, Il est parfait c'est le meilleure téléphone !!!  Avis complet  
168,5," En plus d'être très fonctionnel, pratique et adapté à mes besoins, c'est un bel objet au design léché. A voir sur le long terme désormais mais pas de raison d'être déçu.  Avis complet  "
169,5, Très bel appareil et très fonctionnel  Avis complet  
170,5, Conforme à la photo livraison avant la date prévue je kiffe mon téléphone je recommande ce vendeur les yeux fermés.  Avis complet  
171,5," Très bien, malgré le prix un peu élevé quand même, le S8 répond complètement a mes attentes.  Avis complet  "
172,4, Ce Samsung Galaxy S8 est un beau petit téléphone avec un bel écran comme Samsung sait le faire.. rien à redire côté technique.. après comme d'habitude très peu de personnalisation en ce qui me concerne c'est pour ça d'ailleurs que je l'ai revendu une semaine après..  Avis complet  
173,4, faire bien attention verre trempé est coque de protection non compatible pour ce modele c'est l'un ou l'autre regarder bien sur les forums  Avis complet  
174,4," Acheté il y a environ 2 semaines. Satisfaite du telephone. Facile d'utilisation. Beau design. Tient bien la charge et rapide à recharger. J'ai juste eu un souci au démarrage, je ne recevais pas certains sms et j'avais bcp de mal à en envoyer. Le pblm s'est réglé de lui même, j'ai fouillé dans tous les parametres mais je ne sais pas ce qui a fonctionné.  Avis complet  "
175,3," C'est un bon smartphone dans l'ensemble, pas trop lourd et belle finition, je dirais que sont seul ""défaut"" serait une lentille photo assez moyenne (moyen + quand même). Gestion de l'autonomie impeccable!  Avis complet  "
176,5, Très bon produit correspond à mes attentes  Avis complet  
177,5," Qualité d'image excellente, multiple fonctions très pratiques, prise en main facile...  Avis complet  "
178,5, Toutes les fonctionnalités intégré à ce téléphone On peut tout paramétrer. Très bon et beau téléphone  Avis complet  
179,5, Très bonne produit avec des super fonctionnalité.  Avis complet  
180,5," Très bon prix , très bon produit Livraison dans un temps très correct Je recommande  Avis complet  "
181,5, Élu meilleur téléphone de cette année et sa se comprend  Avis complet  
182,5, ....forcement puisque ca fait 1an que je cherchais LE nouveau telephone pour moi....  Avis complet  
183,5, Tout a fait satisfait du produit! Rien à ajouter d'autres!  Avis complet  
184,5, J ai choisi ce produit pour de très belles photos portable de qualité supérieure par rapport à d autre marque  Avis complet  
185,5, Satisfait et moderne' et technologies  Avis complet  
186,5," Téléphone conforme. Très bon appareil. Reçu en 5 jours. C'est la 2ième fois que je commande sur le site et que tout se déroule bien. Seul bémol cette fois, l'adaptateur international ne fonctionne pas. J'ai dû ouvrir un ""ticket"" auprès du SAV. J'attends un retour.  Avis complet  "
187,5," Performant, impressionnant qualité d'écran et de photo parfaite.  Avis complet  "
188,4, Le tel est facile à utiliser il est léger agréable à utiliser cependant la création du compte Samsung pour finaliser les mises à jour du tel ne fonctionne pas  Avis complet  
189,5, Absolument pas déçu de mon achat fait sur un coup de coeur.  Avis complet  
190,5, super et vraiment pas chere!!!!!@  Avis complet  
191,5," J'hésitais entre l'iphone 8 et le s8 pendant longtemps. Au final j'ai opter pour le S8 et je ne suis vraiment pas déçu...il est magique ! Un design à couper le souffle, l'écran est tout simplement somptueux..je ne peux que le recommander !  Avis complet  "
192,5," La mise à jour iOS 11.0.1 de mon iPhone 6S+ à eu pour conséquence de diviser la durée d'utilisation de sa batterie par deux. Le Samsung Galaxy S8 a une batterie qui suffit plus que largement à lui assurer une bonne journée de travail. De plus, le Galaxy S8 donne autant de satisfaction en terme d'agrément à l'usage qu'un iPhone. Aucun regret d'avoir abandonné Apple qui, grâce à son idéologie d'obsolescence programmée, m'a permis de découvrir un produit de grande qualité.  Avis complet  "
193,5, Reçu neuf fonctionne parfaitement  Avis complet  
194,5," Galaxy S8 sous scelle ! Au top , léger retard à la livraison mais très content du produit ! Je recommande fortement !  Avis complet  "
195,5, Simple et pratique a utiliser. Léger et fin. Bonne résolution des couleurs et bon son.  Avis complet  
196,5, Ce téléphone est super. Samsung ne me déçoit jamais mais par contre la lecture d'empreinte derrière est une chose dont on doit bien s'habituer. Sinon je suis complètement satisfaite de mon achat. A voir si il dure dans la durée.  Avis complet  
197,5, Je n'ai jamais mis aussi cher dans un téléphone mais je ne le regrette vraiment pas !  Avis complet  
198,5," Super smartphone, beau design, grand écran, le son est top et l'autonomie me permet de tenir 3jours... Je recommande l'achat chez conforma :)  Avis complet  "
199,4, Du Samsung en gamme premium Je n’ai pas d’autre remarque a formuler  Avis complet  
200,4," Telephone reçu en magasin samedi mais ouvert seulement mercredi parce que destiné à être offert. Résultat bande de garantie déjà arrachée à l'ouverture. Comme nous étions à l'étranger nous n'avons pu contacter le service clientèle de rue du commerce uniquement vendredi et réponse du service clientèle : délai de rétractation de 3 jours après réception du produit dépassé, nous ne pouvons rien faire. Il accepte éventuellement une réclamation vis à vis du transporteur sauf que la bande n'à clairement pas été arrachée par le transporteur vu que le colis ne présentait aucun défaut.  Avis complet  "
201,5, Une vraie qualité d'écran et une fluidité impressionnante. Je suis ravie de ce téléphone. J'ai profité d'une promotion cdiscount car le prix en magasin est vraiment trop cher. Beaucoup de possibilités sur ce téléphone que je découvre encore.  Avis complet  
202,5, Super téléphone très facile à utiliser. Je n'ai pas encore eu le temps de tout voir mais je le recommande.  Avis complet  
203,5, fonctionne très bien rapide super belle photo ne regrette en rien ce produit .  Avis complet  
204,5," on y dort très bien et le prix est très bien, super service après-vente espagnol, le transporteur français avait laissé à quai un des deux matelas, j'ai appelé directement le vendeur qui a tout de suite appelé le transporteur et m'a rappelé en suivant et a tout arrangé de manière très efficace, serviable et très sympathique  Avis complet  "
205,5," Très satisfaite de mon nouveau Samsung S8, bonnes dimensions, qualité de l'image. Le seul défaut l'écran se salit très rapidement. Je recommande ce produit  Avis complet  "
206,5, Superbe téléphone super fonctionnalité très performant beau design . Que des bonnes notes  Avis complet  
207,5," Bien reçu, confore à mes attentes. Merci  Avis complet  "
208,5," J'ai longtemps hésité avant de franchir le cap et d'acheter un téléphone à ce prix mais je ne suis pas déçu. Très ergonomique et fonctionnel, je découvre de nouvelles fonctionnalités tous les jours! Et en plus il est beau...  Avis complet  "
209,3," Trés bon et beau smartphone, mais pas à mon gout . Aprés utilsation de quelque semaine , prise en mains trés laborieuse, surcouche samsung non untuitive.  Avis complet  "
210,5," je suis très satisfaite ce mon Samsung S8 ,il est conforme à ce que j'en attendais.  Avis complet  "
211,5," Acheter pr un cadeau,la personne en est très ravie.Merci Cdiscount.  Avis complet  "
212,5, Je viens de l'acheter et il est parfait. Fonctionnel et finitions parfaites.  Avis complet  
213,5, o top reçu rapidement .  Avis complet  
214,5, SUPER TELEPHONE REÇU DANS LES DELAIS . UN PEU CHER MAIS HONNÊTEMENT ON OUBLIE LE PRIX QUAND ON VOIT LE TELEPHONE  Avis complet  
215,5, Functions tres bien pour les temps merci beaucoup C discont  Avis complet  
216,5," Ayant abandonné mon s7 edge pour le s8, je n'ai aucun regret. L'écran est absolument magnifique et la surface d'affichage est très agréable. La charge rapide est un plus avec Samsung, je recommande vivement ce téléphone.  Avis complet  "
217,5," Je ne regrette pas mon choix, après de longues années chez Apple je me disais que franchir le pas de prendre un Samsung serait peut-etre regrettable..il n'en est rien ce téléphone est de loin le meilleur  Avis complet  "
218,4," Chargeur américain, sinon bien :)  Avis complet  "
219,5, Ce téléphone est parfait léger Appareil photo au top Rien à redire  Avis complet  
220,4, Très bien. Facile à prendre en main. Après j suis pas un grand utilisateur.  Avis complet  
221,5," Téléphone arrivé dans les délais, sans problème. Je recommande +++++  Avis complet  "
222,5, conforme au attente : très bien  Avis complet  
223,4," Seul bémol, le chargeur étranger avec adaptateur. Il est beaucoup trop encombrant...  Avis complet  "
224,5, Le même téléphone quand magasin... mais pas le même prix !  Avis complet  
225,5, très bon produit a voir sur la duré  Avis complet  
226,5, Bon produits je le recommande pour tous le monde  Avis complet  
227,5, Je découvre le Galaxy S8 et il semble au top !!!!!  Avis complet  
228,5," parfait, un téléphone pour téléphoner mais en mieux...  Avis complet  "
229,5, très satisfais comme d' habitude avec Samsung  Avis complet  
230,4, J'ai ce mobile depuis 1 semaine et je suis encore en phase d'apprentissage  Avis complet  
231,5, Beaucoup de gens disent qu'il as beaucoup de défaut mais moi je n'en rencontre aucun  Avis complet  
232,5, 2 autres personnes ont suivi mon exemple et conseil pour vous dire ma satisfaction. Comme moi elles étaient iPhone depuis wé nombreuses années  Avis complet  
233,5, superbe téléphone très pratique de par sa taille et surtout par toutes les possibilités données. Un bijou de technologie .Je découvre tous les jours . très bon investissement et belle couleur .  Avis complet  
234,4, Smartphone d'une très grande facilité d'utilisation. Les applis. installées sont pour la plupart très utiles et très facile d’utilisations. Très bon Smartphone.  Avis complet  
235,5, Parfait Répond à toutes nos exigences Recommandé à tous  Avis complet  
236,5, Rien à redire efficace Reste le prix néanmoins....  Avis complet  
237,5, Rien à dire ces le top rien à voir avec Apple niveau batterie et application je vous le recommande  Avis complet  
238,5, Artice. Conforme et superbe Rien à redire  Avis complet  
239,5, Très bon prix livraison parfaite comme d’habitude.  Avis complet  
240,5, très bon téléphone déjà 2 semaine que je l'ai rien a dire appareil photo juste magnifique  Avis complet  
241,5," Super téléphone, rien à dire. Tout est au top, je recommande !!  Avis complet  "
242,4," Performant et solide, avec une bonne autonomie et des belles photos  Avis complet  "
243,4, Satisfaite de mon achat malgres l autonomie faible comme tous les autres portables  Avis complet  
244,5," Très bon prix bonne qualité, aucun problème sur le téléphone  Avis complet  "
245,5," Ce téléphone n'a que très peu de défauts : - Bouton dédié Bixby qui ne sert à rien (mais qu'on peut maintenant désactiver au moins) - haut parleur de qualité moyenne et non stéréo (par rapport à un iPhone) Par contre, les + : - écran magnifique - finition parfaite, agréable à tenir en main - appareil photo de bonne qualité, même en basse luminosité  Avis complet  "
246,5, Les fonctions sont top et le service livraison nickel !!  Avis complet  
247,4, Je suis très satisfaite de ce Samsung qui ne se voit en rien les attentes en photo/vidéo et qui me permettra un plus large stockage qu'à l' accoutumé. Une déception cependant sur la couleur de l'appareil...soit je n'ai pas reçu le bon modèle soit les photo de l'appareil qui révèlent une teinte rosée sont trompeuses...car mon appareil est plus bleuté que rosé.  Avis complet  
248,5, Super produit tres belle ecran prise photo super vraiment un tre content merciau vendeur de la roche sur qui montres bien conseiller  Avis complet  
249,4," Ce Galaxy est superbe pour commencer. Au niveau design, difficile de faire mieux. La surcouche Android est légère et la plupart des ajouts sont bien pensés. Petit bémol pour Bixby et pour les émoticônes Samsung moins beaux que les nouveaux d'Android...  Avis complet  "
250,5, J'avais le S6 et le S8 est trop fort  Avis complet  
251,5, Je recommande expressément ce produit. Un téléphone magnifiquement réalisé d'une finition exemplaire. Merci a cdiscount pour la rapidité de livraison. Écran hors norme autant sur son côté lumineux que sur sa définition et sa qualité d'image. L'écran du S8 scotche !! Mobile ultra rapide et bourré de gadgets en tous genres. Je ne regrette absolument pas. Personnellement j'avais un S6 classique et c'était celui la qui m'avait redonné l'envie d'un Samsung. De passer du s6 au s8 c'est encore un gouffre technologique incroyable c'est une nouvelle génération de téléphone clairement. Fonctionnel beau puissant et ergonomique. Si on ajoute à ça une autonomie plus que correcte on frôle le téléphone parfait ! Un écran 5.8 pouces qui recouvre presque toute la face avant. Imaginez c'est une taille d'écran plus grande que celle du iPhone 8 plus mais dans un téléphone plus compact! Samsung magicien! Quand on sait que près de la moitié des composants des iPhones proviennent de Samsung (cf article sur le web Samsung touche 15% de la vente de chaque pomme...) on a la affaire à la crème du smartphone. Les mauvaises langues parleront d'Android. Android qui a bien changé et qui ne subit jamais de ralentissements ou autres mais qui permet tellement plus sur iOS.. . Seul bémol avec les écrans incurvés c'est l'application des films de protection pour l'écran c'est très compliqué d'en trouver un qui fasse l'affaire. Je recommande vivement cet achat !  Avis complet  
252,5," J'ai commandé ce téléphone il y a 1 mois, pas cher par rapport aux magasins et franchement il est nickel emballé dans la boite samsung d origine, délai de livraison rapide Je recommande  Avis complet  "
253,5," je suis tres sattisfait de mon achat. pouvoir allier la performance du S8 + avec le confort de n'utiliser qu'un seul telephobe pour ses 2 cartes sim (pro et privé) pour ma part est geniale. on sacrifie la micro sd, mais ce n'est pas gênant quand on a 64 go de memoire interne. La réactivité du téléphone, ses performances ne sont pas affaiblies. je suis très satisfait de mon achat  Avis complet  "
254,5, Colis impeccable reçu en 5 jours.  Avis complet  
255,5," Très contente de ce téléphone, c' est mon premier smartphone et j' en suis ravie. Facile à utiliser et très intuitif.  Avis complet  "
256,5, Un telephone de malade vraiment trés bonne autonomie et une qualité des photoss juste proteger le il a l'aire hyper fragile  Avis complet  
257,4, UN TEL TRÈS CONFORTABLE ET COMPLET MÊME SI MOINS PRATIQUE A MON AVIS DE SON MODÈLE PRÉCÉDENT. LE PRIX QUAND A LUI UN PEU CHER ? MÊME SI BOULANGER OFFRAIT 150€ DE PRIME A LA REPRISE. C EST BIEN DOMMAGE QUE LES MARQUES DE TEL SORTENT DES NOUVEAUX MODÈLES A MOINS DE 1 AN D'INTERVALLE CE QUI POUSSE A LA CONSOMMATION.  Avis complet  
258,5," Trés trés bon téléphone, trés bonne qualité d'image pour les photos et vidéos. Je l'ai amené partout avec moi, dans l'eau ou dans la poussière !!! Pleins d'options et de fonctionnalités. Juste dommage que BIXBY parle uniquement en Anglais (l'assistant du téléphonne -> Comme SIRi )  Avis complet  "
259,5," j ai acheté un téléphone et je suis entrain de l'utiliser , c’est pratique et j en suis heureux  Avis complet  "
260,5," Heureux possesseur d'un Samsung s8. Je suis comblé. Design réussi, qualité au rendez-vous. Processeur puissant et très réactif. La mémoire extraordinaire 64go. Bourré de gadget et applications que je découvre au fur et à mesure. Merci cdiscount pour vos prix attractif et vos délais de livraison.  Avis complet  "
261,5," Rapide, résolution magnifique!  Avis complet  "
262,5, Génial je recommande ce telephone  Avis complet  
263,5," Colis reçu rapidement , conforme à ma commande, fonctionne très bien. Attention la prise du chargeur est un modèle US mais l'adaptateur pour prises françaises est fourni  Avis complet  "
264,5, tel au top.niveau photo ou video .audessus du lot  Avis complet  
265,2, Fragile... vitre arriere cassée au bout de 48h sur un leger choc  Avis complet  
266,3, Autonomie appréciable! Grand écran confortable! Le changement est notable par rapport au samsung S6 ou S7  Avis complet  
267,5, ras produit conforme tres satisfait merci  Avis complet  
268,5, Prise en main facile. Passage de Windows Phone à Android plus aisé que prévu. J'ai pu garder mon GPS avec mes adresses.... Donc super  Avis complet  
269,5, Rien à redire tout était nickel  Avis complet  
270,4, Téléphone excellent rien à dire  Avis complet  
271,5," l'écran est absolument sublime, ça change beaucoup de mon adoré galaxy s7. +++ à recommander sans problèmes  Avis complet  "
272,5," Reçu en temps et en heures, bien emballé, matériel.net est un bon site professionnel. le téléphone est super beau, assez fin, tiens bien en main et à une autonomie correcte même en utilisant régulièrement tous types d'applications. Oui ce n'est pas donné, mais on a rien sans rien  Avis complet  "
273,5, Très bonne reception du portable ce cadeau a ravi mon mari et très bonne communication car j aime envoyé un mail pour demander ou en étais l envoi de mon colis et il m on répondu très rapidement en core merci  Avis complet  
274,5, tres bon produit et la couleur orchidée est tres jolie moi qui d'habitude privilégie le noir cette couleur est au top  Avis complet  
275,5, très contente de mon achat je le conseille  Avis complet  
276,4, Le film de protection est inutile. Il ne sert à rien  Avis complet  
277,5, La livraison est arrivée assez rapidement après la commande. J'en suis très satisfait.  Avis complet  
278,1, Le colis n'est jamais arrivé et impossible de joindre le SAV  Avis complet  
279,5, Reçu dans les temps sans soucis merci  Avis complet  
280,5, Super très bon téléphone et le vendeur de même. Cordialement.  Avis complet  
281,5, bon produit pour le prix je le recommande très satisfais  Avis complet  
282,4, Le produit est conforme à la commande. Les tarifs sont supers concurrentiels et donc attractifs. Toutefois le délai de livraison est trop long et donc lorsque vous etes de passage difficile de passer commande  Avis complet  
283,5, Livraison rapide et sans soucis. Le telephone est arrivé avec un chargeur chinois mais un adaptateur europeen etait dans le paquet. Je recommande!  Avis complet  
284,5," J'ai acheté cet article il y a un peu plus d'une semaine et j'en suis très satisfait, il est fonctionnel, ergonomique et répond à toutes mes attentes. Récupérer en magasin. Super rapide.  Avis complet  "
285,3," Je regrette le Samsung s7 . Avec cet appareil, j'ai déjà un problème au niveau de l'optique de l'appareil photo. Pour écrire il n'est pas évident.  Avis complet  "
286,4," j'ai pris ce tel pour remplacé un huawei p9 lite. je ne suis pas déçu. il est réactif, écran magnifique, appareil photo superbe. l'autonomie est un de ses point faible, mais contrebalancé par une charge rapide. package complet, adaptateur usb c micro usb et adaptateur usb c usb pour recharger un autre appareil ou transféré les données de son ancien tel sur le nouveau.  Avis complet  "
287,5, Parfaitement conforme a ce que j ai commandé ! Je recommande donc !  Avis complet  
288,5, delai de livraison un peu long et frais de douane que je n ai pas l habitude de payer  Avis complet  
289,5," Excellent téléphone, autonomie top, très satisfait de mon achat !!!!!!!!!!  Avis complet  "
290,5, Ravie de cet achat ! Non seulement il est magnifique mais aussi super à l'utilisation. C'est le top du top . Je vous le recommande vraiment et pourtant j'ai toujours eu des a. ........  Avis complet  
291,5, Livraison un peu longue. Mais heureuse d'avoir reçu mon S8  Avis complet  
292,5, Il es genial. Je suis ravie. Fluide. J'adore Samsung de toute façon.  Avis complet  
293,4," J'ai un galaxy note 4 avec une carte sim mini ce qui veut dire commander chez Free une carte nano 10€ qui ne fonctionne pas dans mon note 4 . Je regrette cette achat, j'aurais dû prendre le note 8. ...  Avis complet  "
294,4," La livraison à été rapide, une semaine. Téléphone d'excellente qualité  Avis complet  "
295,5," facile d'utilisation, très belle image,bonne autonomie,et très bonne qualité de réception.  Avis complet  "
296,5," j'avais un S4, là je suis super ravie  Avis complet  "
297,5, LES + TÉLÉPHONE PARFAIT AVEC DEVEROUILLAGE PAR VISAGE ET/OU EMPREINTES ÉCRAN DE TRÈS BONNE QUALITÉ PHOTOS DE QUALITÉS L UTONOMIE BATERIE DÉPASSE ENFIN 1 JOURNEE D UTILISATION LES - RAS POUR LE MOMENT LE PRIX DE CE PORTABLE N EST PAS AUSSI LEGER QUE CELA MAIS BOULANGER RESTENT DANS LA MOYENNE DES PRIX BAS COMME SOUVENT  Avis complet  
