,stars,comments
0,5, Je me suis acheter le samsung s8 cheter vous et je suis trai conten et maime la livreson et trai rapide merci a l'equipe fnac  Avis complet  
1,5, Téléphone très correct fonctionne parfaitement depuis l achat jamais de beug aucun problème je le recommande très foetement  Avis complet  
2,3, Problème de volume sinon le produi en lui même est correct  Avis complet  
3,4, Belle et coûteuse technologie mais quelle qualité.  Avis complet  
4,5," Découverte de l'univers Android à travers le Galaxy S8 : l'univers Android n'est pas sans défaut mais je suis conquis par ce smartphone. Tout d'abord, l'extérieur excellent :qualité des matérieux et de l'assemblage, prise en main, robustesse ressentie, poids, IP68... Ensuite l'intérieur génial : mémoire disponible, réactivité du système, mémoire extensible, photographie, ... Vraiment si vous avez le budget je recommande!  Avis complet  "
5,5, Reçu en 10 jours parfait très bien emballer ! Trop contente d avoir eu un s8 pour 350 euros moins chèr qu' en France !!  Avis complet  
6,5, Venu du royaume unie. Parfait rien à dire et moins chere . Et adaptateur fournis  Avis complet  
7,5," Génial : très bonne qualité d'image, de photos, de vidéos... grande capacité, rapide. Il est simplement dommage que l'assistant bixby ne soit pas disponible en français.  Avis complet  "
8,5, ravie de ce téléphone. enfin une batterie qui tien la journée  Avis complet  
9,4, Il est facile à manipuler . Il a une très bonne qualité de photo  Avis complet  
10,5," Téléphone super à l'utilisation. Fluide, rapide, et cet écran est juste splendide. Vu le prix en même temps le contraire aurait été décevant.  Avis complet  "
11,5," J'étais habituer à mon vieux Galaxy note 3 mais arriva le moment de rendre l'âme du coup je me suis tourné vers le galaxy s8. Je suis fan ! Écran incurvé qui ne gêne en rien la manipulation, grand écran avec de très belles couleurs, photo magnifique et capacité immense. Je ne regrette pas du tout mon achat !  Avis complet  "
12,5," j'ai acheté ce tél en cadeau pour noel, très bien, beau design, facile d'utilisation. Beaucoup de fonctionnalités, un bel écran, de belles couleurs. Pas de regrets.  Avis complet  "
13,1," Bonjour, Malgré toutes mes tentatives de vous contacter je n'ai aucun retour de votre part. Je n'ai pas reçu mon téléphone. Dans l'attente de votre retour je l'espère. Cordialement,  Avis complet  "
14,5, Très satisfait du téléphone. La qualité de l'image et des vidéo est énorme. Photo parfait hormis pour ceux de face (moyen). Le soft Android embarqué est très intuitif. Délicat c'est la batterie en une journée et demi c'est mort. Je conseil vraiment pour la qualité. Malheureusement pas sympa de faire une promo juste après Noël !!  Avis complet  
15,5, recu dans les temps et en bon etat  Avis complet  
16,5," Super appareil, assez intuitif et simple d utilisation.  Avis complet  "
17,4, trés bon produit rien a dire recu en temps et en heure  Avis complet  
18,4," C'est un téléphone très attractif, de nouveau mode son apparu et de nouvelle fonctionnalité font leur apparition tout en gardent la base de Samsung se qui est très intéressant à manipuler  Avis complet  "
19,5," Le produit a mis une petite éternité à arriver ( direct dans ma boîte aux lettres, vu le prix je trouve que c'est un peu léger...) et j'ai été enchanté par ce que j'ai reçu : un emballage d'origine scellé, un téléphone sublime, lisse comme un galet, beau comme un camion. Prise en main parfaite.J'en suis encore à explorer ses multiples fonctionnalités.J'ai quitté mon super Galaxy note 3 sans regret, après avoir facilement transféré son contenu dans mon nouveau jouet.Que choisir le classe meilleur smartphone du marché et c'est bien mérité Bonne année à tous ! ...  Avis complet  "
20,4, Super téléphone! Le seul reproche est qu'il s'agisse d'un téléphone destiné à l'origine pour les Emirats arabes et que ce ne soit pas précisé dans l'annonce (chinoise). De ce fait la rom est prévu pour cette région et je me retrouve par exemple avec les dates du ramadan dans mon agenda sans que je puisse les retirer...  Avis complet  
21,5, Livraison impeccable et conforme  Avis complet  
22,5, Les photos dans le noir son magique je recommande ce petit bijoux  Avis complet  
23,5," Très satisfait de mon achat. rapide, puissant, un écran remarquable. Parfait !!!  Avis complet  "
24,5," En remplacement de mon ancien Samsung S4, il n'y a que du plus ... Ecran au top très réactif, qualité photo en hausse, rapidité de traitement pour l'installation d'appli ou leur lancement, je n'ai relevé aucun défaut.  Avis complet  "
25,5," superbe téléphone, reçu en temps et en heure, rien à dire si ce n'est que j'ai fait un heureux  Avis complet  "
26,5, Je recommande ce produit car il fait de belles photos il est très fonctionnelle il a une bonne prise en main malgré son cou qui reste un peu élevé j'en suis satisfaite  Avis complet  
27,4, Livraison un peu longue mais pas de soucis sur la réception du colis et le suivi.  Avis complet  
28,4, Pas de 5 eme etoile car se décharge rapidement et toujours pas de mise a jour pour avoir bixby en français. Dommage...  Avis complet  
29,5, Commande reçu sans aucun soucis !  Avis complet  
30,5," Acheté, mis en service et ça fonctionne parfaitement, en plus avec 64 GB de mémoire. ..  Avis complet  "
31,5, Très bon produit facile d'utilisation En main pas trop grand Les appli son facile à trouver  Avis complet  
32,5," Hors norme écran exceptionnel, ultra rapide. Rien à redire.  Avis complet  "
33,5, beau design. Réactif. Plein de fonctionnalités. Je recommande ce produit  Avis complet  
34,5," cadeau de noel pour ma fille qui en est ravie ! très beau, fin et très fonctionnel !  Avis complet  "
35,4," Je viens de l'avoir ,il est superbe dommage que les vendeurs soit incompétent pour m'avoir vendu l’étui Samsung en plus de la protection d’écran temium en verre qui sont incompatibles. Voilà comment gaspiller de l'argent .  Avis complet  "
36,5," J'ai acheté ce téléphone pour ses multiples fonctions et il s'est avéré qu'il est parfait . Bonne prise en main, des photos parfaites super qualité avant ou arrière, avec possibilité de rajouter de la mémoire en plus de celle du téléphone. Prix élevé mais qualité parfaite donc je donne 5 étoiles.  Avis complet  "
37,4, Bon téléphone je les acheter 'neuf' mais il ne les pas le sceller été rompue.  Avis complet  
38,5, Seul petit bémol livraison un peu longue environ 3semaines mais sinon RAS téléphone niquel je suis très contente de mon achat  Avis complet  
39,5, Tout s'est bien déroulé : la livraison la configuration et le transfert des données depuis mon vieil Iphone grâce à le petit adaptateur fourni (bonne surprise) Et pour un prix très compétitif !  Avis complet  
40,5," Ce smartphone est au top de mes attentes bonne fonctionnalité qualité des photos et vidéos super facile à utiliser livraison rapide. Je suis très contente de mon achat, je le recommande  Avis complet  "
41,5," Livraison rapide, article neuf, mise en route rien a dire autonomie très bonne et le prix était très attractif  Avis complet  "
42,5," Parfait, livré dans les temps. Seul un petit bémol pour l'emballage du vendeur.  Avis complet  "
43,4," Le produit est niquel rien à dire toutefois, je ne sais pas si c’est lié au mobile mais en introduisant ma carte sd ça m’a effacé toute mes photos etc qu’il y avait dessus  Avis complet  "
44,5," Ce tel est juste une tuerie. La qualité de l'ecran magnifique, fluide d'un jeu a un autre... la gestion de la batterie tient bien par rapport a ce qui se fait chez les autres constructeurs. Hyper content de mon acquisition!!!  Avis complet  "
45,4, J'ai acheté le S8 pour Noel 2017. Il est super. Aucun problème.  Avis complet  
46,5, Je suis en train de découvrir ce petit bijou . Très facile d'utilisation  Avis complet  
47,4," Grosse différence d'autonomie, de rapidité et marre des mises à jour qui ralentisse l'iphone. Sinon un peu perdu au départ mais la prise en main est facile  Avis complet  "
48,1, commande n°400006834 Jamais reçu  Avis complet  
49,5, Livraison très rapide et téléphone reçu en très bon état  Avis complet  
50,4," belle qualité d'écran et de photo, le reste doit être à la hauteur du prix, je l'espère.  Avis complet  "
51,3, Déçu par la taille de l'écran et il se déchargé vite . Sinon côté qualité photos niquel  Avis complet  
52,4, Le produit est conforme a mon attente mais je me suis promis de ne plus revenir dans votre magasin (quel foutoir)  Avis complet  
53,5," Le téléphone est magnifique, l'écran bord à bord rend super bien . Les photos sont subliment, vraiment parfait!  Avis complet  "
54,5, Téléphone très beau et performant. Fidèle à SAMSUNG depuis des années et je ne le regrette pas.  Avis complet  
55,5," J'ai acheté ce Samsung Galaxy 8 64go en couleur orchidée la semaine dernière, il me plait beaucoup il est grave beau très fluide et sa batterie est très bonne pour le moment elle tiens facile la journée en consommation intensive voir même toute la soirée.  Avis complet  "
56,4, J'ai bien aimé les connecteurs  Avis complet  
57,5," Après plusieurs année sous ios , j'ai décidé de passer a la concurrence , et j'avoue que samsung avec son S8 commence à rattraper son retard et il pourrais bien dépasser son concurrent direct Apple .Question qualité/prix vous en aurez pour votre argent , l’écran est au top , bonne connexion au réseau wifi et 3g,4g,4g+,j'ai d'ailleurs une meilleure connexion qu'avec mon ancien Iphone 7,l'appareil photo est bluffant avec de nombreux filtres ,le déverrouillage peu s'effectuer avec votre visage , les iris des yeux ou encore avec le capteur d'empreinte au choix de l'utilisateur .Sympa aussi le rechargement par induction ou avec le cable usb .Bref il est complet et il est personnalisable à souhait ..Merci encore materiel.net  Avis complet  "
58,5, Rien a dire le téléphone est top et super fonctionnel.  Avis complet  
59,5, Super téléphone rien à redire.  Avis complet  
60,5," J'ai acheter ce telephone il y a 2 semaine il est trés rapide et super fonctionnel , je suis satisfais de mon achat sur le site  Avis complet  "
61,5, Rapport qualité/prix excellent chez e-global pour ce merveilleux Samsung S8. Livraison dans les délais annoncés. Que demander de plus? Satisfaction totale en ce qui me concerne. Merci.  Avis complet  
62,5, A éviter de trimbaler dans les manifs et en soiree  Avis complet  
63,4, Bonne qualité et agréable à l'utilisation  Avis complet  
64,5," J'ai acheté ce Galaxy S8 en ligne sur le site il est d'un très bel effet, fonctionne tres bien, facile a mettre en oeuvre.Modele à double sim me permet de n'avoir qu'un seul téléphone et 2 numéros (boulot et perso) ce qui est tres pratique. (photos d'une qualité je vous raconte pas!)  Avis complet  "
65,5, Article reçu avec un peu de retard car cela provient de Hong-kong et par conséquent avec une prise d'alimentation américaine mais avec un adaptateur EU.  Avis complet  
66,5," Un téléphone super beau. Mais attention à vite le protéger car il glisse tellement qu'il peut facilement tomber et se fissurer l'écran. L autonomie de la batterie est excellente et les applications de base avec Samsung health nous aide à suivre notre santé. D'excellente photo et vidéo me détails est impressionnant. Bonne l'utilisation des applications en général donne un petit effet bureautique. Par contre pour les accessoires, à part le chargeur et les écouteurs, je vois pas trop à quoi servent les autres (adaptateur usb)  Avis complet  "
67,5, J'ai acheté cet article le mois dernier et j'en suis très content !  Avis complet  
68,5, La qualité du S8 justifié son prix ! Rien à redire...  Avis complet  
69,4, Colis reçu en avec quelques jours de retard mais portable fonctionne très bien.  Avis complet  
70,5, Facile à utiliser elle répond à mes attentes très rapide je suis satisfait  Avis complet  
71,5," J'ai acheté ce téléphone la semaine dernière. Il est fluide, fonctionnel. Je suis très satisfaite de mon achat.  Avis complet  "
72,5, Livraison ultra rapide et sérieuse. Excellent produit.  Avis complet  
73,5, Pour ce qui est de capter par contre son clavier est moins pratique.  Avis complet  
74,4, En vrai je sais pas vu que c'est un cadeau pour offrir à Noël et que Noël n'est pas encore passé  Avis complet  
75,5, Acheté pour noël je ne m en suis pas encore servi  Avis complet  
76,5, Il excellent je ne regrette pas cette achat moi qui avais toujours eu Apple .  Avis complet  
77,5, Smartphone conforme à mes attentes très rapide beau design ... En revanche pas de facture dans le colis à la livraison  Avis complet  
78,5," Pour avoir acheté ce téléphone en remplacement d'un très haut de gamme de 2013 j’en suis complètement satisfait, réactivité et rapidité de chargement au top, moi qui possède une bibliothèque musical très importante (2000 titres) en haute qualité les chargements de dossiers,recherche et copie de fichier se font immédiatement. De plus qualité des selfies et performances jeux impressionnante. Seul ""défaut"" l'autonomie qui n'a pas augmentée par rapport a mon ancien téléphone ayant la même capacité (3000mh) malgré les ""amélioration"" fait a se niveaux.  Avis complet  "
79,5," Beau téléphone, pratique, excellente définition d'écran, interface fluide. Seul bémol, la qualité du son est décevante  Avis complet  "
80,5, Bon produit rien d autre à dire  Avis complet  
81,5, Efficace moderne et agréable. De super fonction  Avis complet  
82,5, Je lai achete pendant le black friday. Complètement satisfaite.  Avis complet  
83,5, rapidité pour la réception et une offre plus qu' interessante  Avis complet  
84,5, Très bon produit mais il faut du temps pour découvrir toutes les fonctionnalités. Pour l'instant je suis très satisfaite.  Avis complet  
85,5, Bonne produit.Livraison tres rapide  Avis complet  
86,5, Je passe d'ios a android non pas sans appréhension... Ce S8 est une bête de course dommage que la surcouche Samsung soit mal peaufinée Je recommande l'appareil sans hésiter  Avis complet  
87,4," Super mobile, mais pas très pratique. Et ne parlons pas des protections d'écran... aucunes ne conviennent, j'en suis à ma 3ème en 3 semaine  Avis complet  "
88,1, Que des problèmes avec ce téléphone. On ne peut pas effectué la charge. Parce que le téléphone nous indique que l'humidité à été détecté pourtant le téléphone n'a jamais été en contacte avec de l'eau ni l'humidité. C'est un produit a fuir de toute urgence. Très déçu de cet achat  Avis complet  
89,5, Rien à redire c'est un téléphone au top !!!@!!!!!!  Avis complet  
90,5, Excellente smarphone sa vos le detour a avoire entre les main pour comprendre la realite  Avis complet  
91,5, Excellent smartphone et à un prix très compétitif !  Avis complet  
92,5, Produit + emballage + rapidité de livraison au top à 10000% !!!  Avis complet  
93,5, J'ai acheté ce téléphone pour ces multiples fonctions et il c'est avérée qu'il es très bien le seul défaut et que la reconnaissance d'empreinte et à l'arrière du téléphone donc c'est un peu gênant mais pour les sportives il es parfait surtout que l'on peut mesurer sa fréquence cardiaque c'est génial. Bonne prise en main légèrement plus grand que l'iphone 6. Photo parfaite super qualité avant ou arrière. Avec possibilité de rajouter de la mémoire en plus de celle du téléphone. Prix élevé mais qualité parfaite donc je ne regrette rien 5 étoiles.  Avis complet  
94,5, Très beau téléphone beau désigne il est très léger et fin a voir dans la continuité je l'ai depuis une semaine.  Avis complet  
95,5, Il est très bien la batterie tient très bien vu que je fait pratiquement tout avec  Avis complet  
96,5, Smartphone magique Je le recommande à tout le monde  Avis complet  
97,5, Ce smartphone est magique passer de iOS à un s8 c'est le jour et la nuit C'est un plaisir de l'utiliser au quotidien  Avis complet  
98,5," La couleur Orchidée est davantage plus foncée dans la réalité que sur les photos mais reste toutefois originale. Le S8 est excellent, beau, rapide, et fait d'excellentes photos. Le top du top ! ;-)  Avis complet  "
99,5," Ecran fragile du aux bords arrondis, objet design ce qui justifie son prix, sinon foncez chez les autres fabricants ce téléphone est chic, et donc cher. Reconnaissance d'iris lente.  Avis complet  "
100,5, Pour plusieurs commandes et un très bon service de votre part je vous mets la note de 5 étoiles pour le délai accompli des produits l'accueil et prévoyance des informations de votre part par email merci continue comme ça Luciano MORAIS  Avis complet  
101,5," Du très très haut niveau, jamais aucun téléphone n' a été aussi parfait depuis l'histoire de la téléphonie mobile. Rapidité exceptionnelle, prise en main hors du commun, fonctionnalités époustouflantes, une beauté sans pareille. J'étais iphone mais là, le S8 a franchi une autre dimension. Mon amie a vendu son Iphone X pour s'acheter le même que le miens mais en S8 plus.  Avis complet  "
102,3, le téléphone est performant fonctionnel ne plante pas mais sincèrement l'arrière du téléphone je m'attendais à mieux que du plastique d'une qualité carrément médiocre surtout à ce prix ...  Avis complet  
103,5," Maniable, puissant, il est à mon sens le meilleur android du moment. Merci Samsung  Avis complet  "
104,4, Quelques difficultés de prise en main puis suit un vrai plaisir  Avis complet  
105,5," Très bon mobile, après le S6 et le S7 edge que j'ai posséder avant, c'est vraiment le tel qu'il faut avoir. Attente avec impatience la mise a jour vers la version Androïde 8.0. il reste quand même un point faible, sons prix!!  Avis complet  "
106,1," Mon article n'est jamais arrivé, jamais je n'ai su avoir quelqu'un au téléphone et aucune réponse par mail non plus. Grosse arnaque!  Avis complet  "
107,4, Promis en 72h reçu en 144h mais dans un état impeccable donc content.  Avis complet  
108,5," J'ai acheté ce portable la semaine dernière et j'en suis très satisfaite. Seul petit bémol : l'écran est assez fragile, il se raye facilement et les protections en verre trempé empêchent le tactile de fonctionner sur ce portable... Autrement tout est conforme !  Avis complet  "
109,5," J'avoue avoir été stressé juste apres avoir passé commande .1 prix aussi attractif, je trouvais ça curieux. Voila 2 jours que je l'utilise, je le trouve genial.Le produit est conforme, mis a part quelques petits pocs sur le coté à peine visible.J'encourage vivement ce vendeur tres reactif et professionnel.Merci  Avis complet  "
110,5, Je suis très satisfaite de mon achat effectué il y a une semaine c'est un smartphone très réactif  Avis complet  
111,5," dans le domaine du smartphone, c'est le meilleur  Avis complet  "
112,5," Sensibilité, rapidité, et surtout copie très rapidement mes anciens logiciels, contact etc. à conseillé  Avis complet  "
113,5," Un très bon téléphone, pratique, beau design et puissant  Avis complet  "
114,5, Très satisfait suite à mon passage pour l'achat de mon produit  Avis complet  
115,4," Le Samsung Galaxy S8 est un bon téléphone, simple et efficace. Le seule bémol de ce smartphone est son prix malheureusement très élevé. PS : Faire également attention si vous souhaitez protéger intégralement votre téléphone (coque arrière + verre trempé) ses cotés incurvé empêchent certains verres trempés de s’emboîter avec certaines coques arrières  Avis complet  "
116,5," Étant avant pros iPhone, j'ai décidé d'essayer de changer et de passer chez Samsung et franchement je suis très très satisfait, que ça soit sur l'autonomie, qualité d'image et toute les fonctionnalités Concernant le vendeur je trouve qu'il est très sérieux, produit tout neuf et bien emballé, délais de livraison respecté voir en avance.  Avis complet  "
117,5, La performance est là (excellente fluidité des apps) tout en préservant l'autonomie.  Avis complet  
118,5," Arrivé en magasin pour prendre le silver, je suis finalement reparti avec l'orchidée qui me ravi amplement esthétiquement. Le smartphone est juste parfait. Rien à dire.  Avis complet  "
119,4, J aime bien le black fait sophistiqué classe pour l instant pas de mauvais point  Avis complet  
120,5, Excellent téléphone comme tous les Samsung.  Avis complet  
121,5, Rien a redire si se n'est que je ne regrette pas du tout mon achat.  Avis complet  
122,5, Dommage je suis à ma 3 ème vitre même la meilleure ne tiens pas!!!!!  Avis complet  
123,5," Téléphone vraiment magnifique, finitions au top la couleur orchidée est vraiment mieux en vrai que sur les photos. Prise en main très agréable l écran est superbe. Le seul tout petit bémol...les écouteurs, bien pour écouter la musique mais moi je m en sera beaucoup pour téléphoner et pas top Livraison en 3j devait être livré entre le 1er et le 5 il était là le 1er au matin.  Avis complet  "
124,5," Je le découvre encore mais c'est un superbe smartphone puissant, très bien fini qui remplace à merveille mon vieux S4 ?  Avis complet  "
125,4, Le tarif est correct ;) Il est super beau et rapide. Le point négatif c'est que l'écran se raye facilement. il faut prendre une protection :( A part ça très bon téléphone  Avis complet  
126,4, bien regarder la notice d'utilisation téléchargée sur internet pour comprendre le fonctionnement des applications  Avis complet  
127,5, Parfait il répond à mes attentes  Avis complet  
128,5," Tout est très bien pensé, très fluide, très rapide, superbes photos, beaucoup de fonctionnalités, beaucoup de mémoire; Prise en main facile, de nombreux réglages et menus déroulants. Sans aucun doute le meilleur smartphone.  Avis complet  "
129,5," Tout est très bien pensé, très fluide, très rapide, superbes photos, beaucoup de fonctionnalités, beaucoup de mémoire; Prise en main facile, de nombreux réglages et menus déroulants. Sans aucun doute le meilleur smartphone.  Avis complet  "
130,5, Nickel ! De la haute qualité Samsung !  Avis complet  
131,5," La qualité de ce téléphone est top. L'écran est sublime. Mon seul regret est au niveau du son : la sortie audio se situe en bas du téléphone sur un seul côté, il suffit de tenir le téléphone normalement pour empêcher d'entendre l'audio, et la prise jack est également sur le bas du téléphone.  Avis complet  "
132,3, En cas de casse ecran ou vitre arriere . Plus de garantie. Meme réalisé chez samasung pour l ip68 . 99 euros vitre arriere. 339 ecran  Avis complet  
133,5, J'ai fais un heureux en lui offrant pour son anniversaire. Au regard il n'y a rien à dire.  Avis complet  
134,5, Je le choisi parce que c'est un bon produit et il est performant très facile à utilisé pour mon entourage je me le conseillerai  Avis complet  
135,5, Hdg Samsung. Livraison en 3j ras conforme à sa description  Avis complet  
136,4, Facile à utiliser. Agréable à regarder les vidéo.  Avis complet  
137,4," L'écran est juste magnifique. Ça répond à mes attentes...moi qui aime la technologie avancer , les fonctionnalités de celui ci sont juste bluffant... juste le bémol qui gâche tout c'est bixby comme tout le monde me dit que ça ne sert pas grand chose. Sur ce je vous le recommande et faite s en bon usage !^^  Avis complet  "
138,5, Top produit. Qualité du smartphone excellente avec une finition au top  Avis complet  
139,4, Produit neuf. original et conforme à la description Excellent smartphone. Normal c'est un s8 Reçu très rapidement merci  Avis complet  
140,5," Magnifique écran, très bonne qualité photo ,ultra rapide... Je le recommande vraiment... Merci à cdiscount  Avis complet  "
141,5, Téléphone reçu dans les délais et neuf avec la boite complète  Avis complet  
142,5, Dans l attente de sa découverte prochaine apres mise en place de mes options applications préférées et de finaliser le transfert de S6 j ai hâte de.... Photos videos qualité Samsung. Rien à dire...(bon le prix un peu cher mais je sais ou je vais) pas de doute ?? C est Samsung quoi !!!??  Avis complet  
143,4," Super téléphone. Ecran magnifique, super rapide, bonne connexion, de la place (64go) pour tout mettre. La reconnaissance faciale marche d'enfer. La reconnaissance d'iris aussi (mais moins utilisé car plus contraignant) Une bombe niveau technique !! Cependant, le bouton physique Bixby qu'il y a en plus ne sert à rien. C'est encore une application forcé par Samsung. Les différentes MAJ du téléphones bloquent le réassignement de ce bouton à une autre fonction (mode avions, silence, ouvrir google). C'est vraiment lourd. Le téléphone a de belles dimensions, voire trop grand pour une utilisation à une main. Les bords arrondi.... et ben ca a l'air d'être une fausse bonne idée. Quand on le tiens on a souvent un bout de doigt ou de peau qui touche l'écran et nuit à l'interaction avec l'écran, alors on le serre moins dans la main et on a juste peur de le faire tomber. Sa surface extrêmement lisse des 2 cotés et sur les bords en fait une vrai savonnette. Ajout d'une coque anti-grip obligatoire, mais ça ne résout pas tout.  Avis complet  "
144,4," Le délai de livraison a été très rapide, mon seul regret est de ne pas avoir reçu ce smartphone dans son emballage originel.  Avis complet  "
145,5," super , avec une qualité d'image très performante et un style très original. très bon produit.  Avis complet  "
146,5, telephone tres fonctionnelle simple  Avis complet  
