,stars,comments
323,5,Very good phone and easy to use. My kids love it .
324,5,Apple really has outdone itself with this phone. It has so many different useful features that Im still learning on how to use them all.
325,5,"Love this phone easy to use, fun to use. The full home screen is the best part of the phone."
326,5,Definitely worth the wait! Still discovering all it has to offer.
327,4,"The new iPhone is great. Portrait mode for the camera is awesome. However, the GPS does not pick up my exact location which is frustrating when I use it to drive"
328,5,Love the iPhone X. So much fun to use. Not having a home button is great!
329,5,What’s not to love!?! Totally enjoying my new iPhone.
330,5,Fast clean clear love this phone. Worth the price.
331,5,This phone is awesome the price is a little high but well worth it!
332,5,Absolutely best phone I’ve ever owned !!! And I have owned a lot of them...
333,5,Great phone super fast love the screen and love the compact phone with the large display
334,5,iphone X features an all-screen design with a 5.8-inch Super Retina HD display with HDR and True Tone. Designed with the most durable glass ever in a smartphone and a surgical grade stainless steel
335,4,Amazing portrait filter for both cameras! Facial recognition is absolutely amazing! The only downside is the size of the phone itself!
336,5,"Great for me but it’s smaller than the plus that I had. Disappointed in the screen size though, even though it’s bigger when videos play they are the same size as my previous 6 plus"
337,3,"At first I was a little hesitant to buy this phone because it was it was so expensive but with the investment I had already made with apple I figured I would give it a try. I was not disappointed. While it is true that many of the touted features (face rec, wireless charge, etc) are a nice to have, they have been around for some time now. I, like thousands of others, are disappointed in the lack of a headphone jack but am making due with some bose earbuds I bought with it. At any rate, my initial feedback is good but I do not see the cutting edge technology that Apple is known showing up in this phone. Dont get me wrong, it is a great phone but so are the other phones in this ""class"" of premium phones."
338,5,I’ve only had this iPhone X for three days but it was easy to get used to. I have noticed that the battery last longer than my previous iPhone 6.
339,5,"Originally had no desire to upgrade to the iPhone X, but it’s by far the best iPhone released to date."
340,4,Been excited about this iPhone I upgraded from a 6plus so I definitely was do for an upgrade. I wanted a whole different iPhone than all the previous ones they all pretty much look the same to me. So like I said I went from a plus to this n I must say even though the screen is bigger on this new iPhone I liked the screen on the plus it’s wider n when texting the keyboard ain’t as crammed. Another thing is the whole swipe is totally different then regular iPhones. I hate the whole closing of apps seemed easier to do on other iPhones. Plus had to YouTube how to screen shot since there’s no button. It’s a whole learning experience. I miss my plus
341,5,"the iphone x is amazing. it has great camera loud and clear speakers and best of all, long battery life..."
342,5,"Nice camera, bigger screen and easier to carry, Love the face recognition"
343,5,"Best iPhone yet they really got everything right. Steep price but, worth it in the end."
344,5,"Love the new iPhone. Easy to use, intuitive ... such a joy to use."
345,5,"Not sure what I can say about it. If you’ve always had an iPhone this is a major improvement. If you coming from android, welcome and enjoy. The simplicity of the iPhone makes your life easier."
346,5,The camera has so may options the pictures are much better than the IPhone 7
347,5,"It’s not perfect but then again, it comes pretty close to it. Closer then anyone else. Love it. Not really happy about the battery percentage not being displayed but I’ve learned to live with it. Small learning curve with the new gestures but very easy to get used to and within the first few hours you’ll feel at home with it. Recommend."
348,5,This is a great iPhone to have. It might take a little getting used to with the new swiping gestures but very easy to learn!
349,5,There is a bit of a learning curve at first with the lack of a home button but overall apple delivers! The facial recognition is super convenient and the gestures make you feel like you are more in control. The pictures it takes are beautiful. Hands down the best iPhone yet!
350,5,Love this phone face recognition is pretty cool just have to get use to the size
351,5,This was a gift for my daughter She really likes it The Samsung app doesn’t let her watch work as well as her Samsung phone
352,5,This phone is amazing. It literally is a small computer. The possibilities are endless.
353,5,"Great item! High quality, looks great. Easy process. Love my new phone!"
354,5,"Upgraded from 6plus to iPhone 10. Pretty much same interface, just with a new face lift. Love the new design. Only took a few hours to get use to gesture."
355,5,This phone is awesome. There is a small learning curve with the home button being removed.
356,5,Great camera and I love Face ID which is more secure than Touch ID
357,5,There's a bit of learning this phone since I was use to Samsung. I like it a lot and it's getting easier. Perfect size phone. No problems so far.
358,5,I am so happy that I got this phone. It is even better than I expected.
359,5,I love my new iPhone X. It is smaller in my hand than the 7 Plus I had prior but I quickly adapted and wouldn’t go back. Must have!
360,5,"Smooth, fast, many amazing features. A quality product. Hey, it's an Apple."
361,5,Love this phone Doesn’t come with instructions but I YouTubed it and I am so in love with my phone
362,5,This phone is super fast and responsive. The size is perfect for your hands.
363,5,Whatever you need or any problems you may encounter with an iphone... Best Buy is the place to purchase it. No hassle for help like AT&T or Apple.
364,4,"Same as any other iPhone. Works fine now, just hope that it will continue to work as time goes on."
365,5,"I was nervous to switch from my 7 plus, but man I am glad I did. It is a fantastic phone, and the screen is remarkable. Highly recommend"
366,5,It’s a great phone and easy to use and I like the size too.
367,5,great phone in screen and lot of storage. battery seems to last a long time as well
368,5,"iPhone X is well worth the money. From the QI charging to the face recognition, you will not be disappointed. I purchased the 256 gig memory due to the HD recording, combined with Apple Care Plus put this purchase over $1300. On a positive note we received a iPhone 8 as a BOGO promotion. Nice job Best Buy and AT&T"
369,4,Purchased at Newington Best Buy. The customer service was great. The camera is sweet. Phone has a lot of good features. Pricy though.
370,5,I’ve always had android phones. After seeing one of these in person I couldn’t resist. Absolutely love it. Camera is amazing.
371,5,The phone is good. Only problem I have with the phone is that it’s small thought they would have a plus size for it but other then that it’s good.
372,5,the best iphone ever made. a great phone at an extreme value.
373,4,Bought at Amazon store with great help from salesman. Got unlocked to use with my company account - simple activation. Phone itself is awesome with Face ID and an incredible screen. Decent battery life thus far :)
374,5,Love the large screen in the same size phone. Best iPhone yet
375,5,"I’m a huge iPhone fan, and love the new features of this phone, especially wireless charging and FaceID"
376,5,I really like the new features on this phone. Camera quality is great
377,4,Great phone with a lot of extras. It's awfully pricey. I am concerned that maybe Apple dialed back the speed on the old phone I had in order to sell the newer products. Great customer service from Best Buy
378,5,The phone is great with many excellent features. It was easy to set up and transfer data/photos from my older iPhone 6. Only tricky thing was understanding how to transfer my existing service but a quick web search got that taken care of.
379,5,I absolutely love this phone. The cameras are awesome!!
380,5,I absolutely love this phone! I’ve had it just over a week and I was used to everything new within a day except the feature where you have to hold an app before swiping up to hard close them. My new favorite feature besides Face ID is the portrait mode in the camera and the upgraded cameras!
381,5,Wow!!Great phone and I’m still learning new features!! Wow!! Expensive!! Not sur yet if it’s worth the extra cash but I am enjoying it if I can just remember that there is no home button!
382,5,I love my new cell phone. It took time to learn all the new features. But with the help of Google and the awesome Best Buy employees I have learned how to use my new phone.
383,5,I love this phone. It has an amazing camera and the screen resolution is amazing. Took a minute to get used to no Home button but now would not go back to a button
384,5,The best iPhone ever made. The best camera on a phone and at a tremendous value.
385,5,I’m a apple product person and I enjoy my upgrade. Now I’m talking with Family and Friends about the latest apple products
386,5,Went from 6+ to x. Love love love. Only took a few minutes to transition with the changes. The new size is great. Basically same screen size as the 6+ but easier to hold.
387,5,At first its hard cause were all used to the button in the bottom but in 1 day of usage you get used to it. Overall phone great
388,5,"I have been using my iPhone X for about 4 weeks. It is the best and fastest iPhone on the market. I am amazed by its screen - no other iPhones can beat it. It is so fast. No delays to open apps on it. I love it, although I have to admit it is quite expensive."
389,5,This is my second iPhone ever.! And I must say this iPhone X has really stood up to its hype. The battery life is amazing and the extra screen size is really nice. You get used to the small center screen cutout.
390,5,"a nice upgrade from the iPhone 6s Plus, couldnt be happier."
391,5,my son had to have it for xmas and its a good phone but didnt live up to the hype for this exclusivity that they were trying to sell
392,5,"I purchased the iPhone X last month and I'm not disappointed with any of the changes or upgrades from my iPhone 6. Th picture quality is much better, it's much faster and with Face ID you access it instantly."
393,4,The size is great bigger screen than 7plus but overall smaller phone. Difficult to get used to no home button.
394,5,I love this phone. It is super smooth and not having the home button has already been forgotten. I love the big screen.
395,5,This phone was a Christmas present for my teenage son which is an upgrade from iPhone 6s plus. He loves it. Great sounds and excellent picture quality.
396,5,"I love my new phone. The phone has streamlined features and new features that make it easier to use. The picture quality is excellent. You still get the big screen without all of the extra phone size so the phone is much easier to handle, even with a case."
397,5,This is my first new phone since the iPhone 6. It’s also the first new phone since the 6 that I thought had enough new features to warrant a new phone. Face ID is awesome.
398,4,Another great iPhone from Apple. This time however there are some flaws that I’ve found. Face ID. Takes time getting used to. And not always consistent as Touch ID. iOS 11. Everything done on this phone is gesture based. No home button. This really takes some time to get used to. Also iOS 11 is plagued by bugs that really deter the experience. That’s why I left 4 stars honeslty. iOS 11 is a clunky mess that needs lots of work and can hinder the experience of this great phone.
399,4,"I really like the facial recognition and the camera. I don’t like how Apple restricts access to files with the new OS. For example, I used to be able to find images I took by connecting to a computer but that option is now gone."
400,5,I love my iPhone X! I was a little hesitant at first with it not having a home button. But after 5 min I did not miss it at all. Face ID works great and it is super fast! I love it!
401,5,"Costly but seems be worth it. Curved screen, bust costly for repair"
402,5,"Ive had every iphone that has came out after the 3G , and i mist say “ that i really do love this phone “ ! Especially the face recognition! I no longer have to use my fat large thumb multiple times to get into my phone . Just a simple tap to turn on ,or the phone itself knwoing you picked it up and looking at it . So that it unlocks! I love it !"
403,4,"Great phone, way too expensive, money no problem though...."
404,4,"Aside from all the fancy new features and bezeless display, it is an iPhone with IOS11. You can probably get the same features in the iPhome 8 and save a few bucks. The X is a lot smaller than I thought it would be so keep that in mind if you are coming from a larger phone."
405,5,Just have to get used to no home button but the clarity is amazing vibrant colors really fast processor
406,3,"Im honestly not very impressed with this phone. I was under the impression Apple was designing this phone with the ability to essentially be used as a computer, with connectivity to a keyboard and display. This is not a feature I would use often or is of great importance, but it is innovation and could help support the price of this. Additionally, why make this in all glass? (Aside from the fact that it will boost accessory sales as well as repair revenue). This phone still acts glitchy and I got the unlocked version with 256GB memorory. The unlocked version has 4GB of RAM vs the traditional iPhone X models (Carrier Specifict Models). You can research this to confirm if you doubt this is correct. I am at the point where I might just return the phone and either choose another alternative such as the Google2 phone or the BlackBerry KeyOne. My life is cluttered enough, sometimes getting back to basics is most important. Especially when the difference in price is $700.00!"
407,5,I love this phone! The camera takes such great pictures. The video quality is great as well. Best iPhone to date!
408,5,No home button = no problem! Emojis are fun. The processor is amazing! Best iPhone Apple has ever made!
409,5,"Great phone, fast and has a lot of cool options. The face recognition program is fun."
410,5,I’ve owned every iteration of iPhone. I can easily say that without a doubt this is the phone we’ve been waiting for. From the full screen to the animoji’s and 4K Video. This is the one.
411,4,Bought a 8 Plus and a X. The 8 Plus was the first product I ever recommended not to buy based on the price versus improvements. The X has more improvements but has even a higher price. I actually like the simple improvements and was easy to figure it out. ( I’m old and not tech savvy) If you have the money it’s nice
412,5,"The next generation phone, best choice for younger"
413,5,Apple did it again. This phone has awesome battery life and the screen wows
414,5,I love this phone so far. It’s smart!!! Both cameras are magnificent and the battery life is a lot better than previous phones. Display is exceptional also.
415,5,Its a gift for my sister and she should be the one to review :p
416,5,The camera is phenomenal. I am ecstatic about all of its capabilities.
417,4,I absolutely loved this phone at first. I have been in the Apple store twice and on the phone 2 times. After I had to wipe everything off my phone and started over I am trying to fall in love again.
418,5,best purchase for the year. animated emoji best part of this version.
419,5,Great great great great great great great great great
420,3,"Upgraded from a 5s, huge upgrade. Too many bugs, Pandora makes it soft restar CONSTANTLY, the lock screen tends to disappear CONSTANTLY... things you wouldn’t expect from a $1,200+ phone."
421,4,Everything as advertised. Great phone and pics. Still exploring the fun things to do. Only wish that Best Buy would have included activation instructions for my upgraded phone. I was able to figure it out on my own but it just would have made things a little simpler
422,5,I love the phone. Apple has make another fine product.
423,5,It takes a awhile to get used to no buttons. It has a awesome screen
424,5,Love camera. Love swiping love not having home button.
425,5,The anniversary iPhone X is the best of breed. It has truly awesome specs. The price is equal to the quality and performance - high. but work every penny
426,5,I love this iPhone and like the Face ID feature. Also the pictures clarity is phenomenal. The volume of the ring sound lowers as soon as you look at it and it recognizes your face which is great too.
427,4,"In fact I thought I would have a way better camera, but is not a big deal. I may go visit a technician t see if my is working well"
428,5,Love my new phone it’s amazing Best Buy is awesome would recommend to anybody sales people very friendly I will always return
429,4,"I was super content with my old 5s and had no intention of upgrading, but very Glad I did. The picture quality is amazing!! Same similar functions as the old phone so it’s very easy to use, if you are familiar with the iPhone."
430,5,"I wasn't sure I wanted this new phone until I was having trouble with my 7,but the retina scanning is the most amazing this I have seen in a while. It really works well and is so hassle free when it comes to using the phone. This is jus one of the many features I love, the other is the sharpness of the new camera. Well done Apple!"
431,5,Nice phone. Takes some getting used to no home button. New learning curve.
432,5,I thought not having the home button would be a problem but swiping was easy to adapt to. Face recognition works well.
433,5,Great phone so far. Fairly reliable Face ID that works with most apps.
434,5,"I really love my phone and trully love the bestbuy.,"
435,5,Love face recognition and camera. No home button was a bit of an adjustment.
436,5,This iPhone is amazing..the full screen is awesome and the colors are vibrant! There is not a single thing on this phone I do not like! Highly recommend it!
437,5,"I really love this iPhone!! It took a little getting used to and how to work things. But once you do, it’s great!!"
438,5,The sliding up takes some getting use to without having the home button but I think it’s been a great upgrade!
439,5,Love the phone but the only real benefit of the iPhone X over the 8 is the OLED screen. Face recognition is nice but isn’t worth buying alone. Most apps don’t take advantage of the larger screen yet and crop it to the same size as if you had an 8
440,5,"Great phone, just wish they sokly have made a plus also"
441,5,The iPhone X is worth it. Both my brothers have it. I did a lot of research to find out if it was worth the extra money. I upgraded from the iPhone 6s. In the back of my mind I was thinking about trying it out for a day or two then taking it back. I will not be taking it back this phone is awesome.
442,4,"Love the IPhone X. Upgraded from an IPhone 6 Plus. I was worried about the home key going away, but it is no problem. The phone is very easy to use. Just hate the price tag, more than my first car!"
443,5,Love the feel. New size and screen a plus. No button getting comfortable.
444,5,My phone is terrific. I love that has all features
445,5,Wished it had a home button and it keeps freezing up a lot
446,4,"I bought as a gift, you need to learn a lot for the new operation"
447,5,This phone is amazing and very happy with my purchase.
448,5,The Face ID is worth the upgrade on its own. Plus having a smaller phone than the plus with an even slighter larger screen is no brainer to me. Have not found anything to complain about yet with the phone. Battery life is great as well.
449,5,"I upgraded from the 7 plus to the X and was initially concerned about the difference in size. Much to my surprise, the sleekness of this phone is very nice. I don’t even miss the larger size."
450,5,I love this iPhone!! Apple finally got rid of the screen border. Only negative is wish it came with AirPods:( Oh Well!! My husband loves his new IPhone X too!!
451,5,"Everything processes so much quicker than previous phones. Also, the facial recognition is fun and again speeds up the unlocking of the phone."
452,4,I think it is too early to buy this phone...especially as the price is so high. Not particularly impressed off the bat. I was expecting much better speed but have been disappointed so far. Facial recognition is not worth the hype...at least from my limited use.
453,5,"I love the larger screen size on this phone, camera quality is amazing, and the facial recognition is convenient. There are so many features that are new compared to my older version. I do think the price is high."
454,2,If you love your iPhone you’ll hate this phone. The size is great but the phone is terrible
455,5,"Easy to use, love the new update and the camera! The portrait camera feature quality is like taking pictures from a high end expensive camera!"
456,5,Worth the investment. It’s face recognition is exceptional
457,5,"Daughter loves IPhone. So we waited for Christmas. She works hard and needs,a phone she can rely on for safety reasons. It's something apple create is a classic reliable phone. Thank you."
458,5,iPhones get better and better. Now I want an iPhone X plus (when it comes out)
459,5,So far this is one of the best iPhone Apple has came out with! It’s a little different without the home button but learning about the new features is even better!
460,5,I love my iPhone X. The home button not being there was different but not bad.
461,5,"So far so good! Easy to go from 6S to the X. Fast, clear and bright screen. Much better photos!"
462,5,Glad I upgraded. Would have gotten 3 if they weren’t so expensive
463,5,"This smartphone is the best phone I’ve ever used - the speed, camera and capacity is robust."
464,5,Never knew getting rid of the home button would change my life.
465,5,Great phone best one I had yet upgraded from a iPhone 6
466,5,From the moment i bought it i loved it. I thought the phone being smaller was going to be a problem but the total opposite.
467,5,Best iPhone ever. Takes some getting used to as there is no home button. So much easier without one.
468,5,Upgraded from the iPhone 6 and I absolutely love it.
469,5,The phone is awesome it gives you the capability of performing numerous task seemlessly.
470,5,"Great screen and perfect size. Not as bulky as a plus. Camera is great, as good as my dslr."
471,5,"Just got my iPhone X and I can not believe how nice it is. I thought it would be hard to get used to not having a home button, it is not! And face recognition it works and it’s great! Best iPhone yet!"
472,5,I was not a fan of it at first but the camera is definitely so much better glad I bought it
473,5,This iPhone has the best camera. I am so happy with my purchase.
474,4,Bought the iPhone X for the camera since it's rated #2 by DXO Mark. I was hella disappointed when there's barely light in the room and the flash kicks in. It ruins the pictures with red eyes. That for me was enough not to keep it. Very disappointed
475,5,"This phone is absolutely amazing with an amazing camera. The detail is perfect. I upgraded my phone in time for a trip to Iceland and was beyond impressed by the pictures. The phone is very user friendly as usual and the extras like facial recognition are a nice added feature. The “notch” took some getting used to, but I don’t even notice it anymore. I do wish I could put the battery percentage on the battery again, but it’s not a huge deal."
476,5,"I love my iPhone X, works great I have it for a month now."
477,4,I am really impressed with my new IPhone X. It is definitely an upgrade from my IPhone 6 Plus
478,3,Good product but after using it for a week I returned it due to the lack of a home button and the multi-step process to close apps. Probably needs some tweaks to the software before I would reconsider. Much happier with my IPhone 8+.
479,5,I bought the iPhone X about 3 weeks ago and I love it. Face ID is amazing and I love how easy Apple pay is to use
480,5,Great phone. Good improvement over the iphone 7. Screen is amaizing.
481,5,Facial recognition works fine - not worried about storage ( 256 g) Glass protector and otter box - All doing just what they advertised !!!
482,5,IPhone X so much better than the IPhone 5. Facial Recognition is so cool and the new screen size from edge to edge is perfect. Larger screen and yet it still fits in my pocket. I bought it in the Capitola Mall Best Buy Store with help from Vanessa T. She was the best!!! I hated going to the AT&T store but Best Buy was great!
483,4,"I must admit, I am that guy that gets each new iPhone. They string me in every time! So being someone that has been through every version, I can honestly say this is my favorite iteration of the phone, ever. This is by far, the best iPhone! It’s fast, the screen is beautiful, and the facial recognition works amazingly. Many complain about that small bump that takes up real estate from the screen. It did bother me at first. After 2 weeks, I don’t seem to notice it anymore. My only complaint is the fingerprint reader unlocked everything faster. I didn’t even need to lift the phone. The facial recognition does work great, but you have to have your face right in front of it. I cant really consider that a flaw, seeing as that is what the phone intends to do. Overall, the phone is worth the money!"
484,5,Way more crisp and clear than last. Facial recognition is amazing and better than expected.
